annotations:
  author: runner
  date: '2022-05-25'
  revision: 309
database:
- name: A nomenclatural ontology for biological names
  prefix: nomen
  releases:
  - retrieved: '2022-01-11'
    version: '2019-04-17'
  vtype: date
- name: Agronomy Ontology
  prefix: agro
  releases:
  - retrieved: '2021-02-02'
    version: '2020-04-03'
  - retrieved: '2021-07-27'
    version: '2021-07-01'
  - retrieved: '2021-11-11'
    version: '2021-11-05'
  vtype: date
- name: Allotrope Merged Ontology Suite
  prefix: afo
  releases:
  - retrieved: '2021-02-02'
    version: REC/2019/05/10
  - retrieved: '2021-02-04'
    version: 2019/05/10
  - retrieved: '2021-06-14'
    version: '2019-05-10'
  vtype: date
- name: Amphioxus Development and Anatomy Ontology (AMPHX)
  prefix: amphx
  releases:
  - retrieved: '2021-02-02'
    version: '2020-12-18'
  vtype: date
- name: An ontology of core ecological entities
  prefix: ecocore
  releases:
  - retrieved: '2021-02-02'
    version: '2020-12-18'
  - retrieved: '2021-02-25'
    version: '2021-02-17'
  - retrieved: '2022-03-26'
    version: '2022-03-09'
  vtype: date
- name: Anatomical Entity Ontology
  prefix: aeo
  releases:
  - retrieved: '2021-02-02'
    version: '2014-12-05'
  vtype: date
- name: Animal Trait Ontology for Livestock
  prefix: atol
  releases:
  - retrieved: '2021-02-02'
    version: 13-09-2018
  - retrieved: '2021-06-14'
    version: '2018-09-13'
  vtype: date
- name: Antibiotic Resistance Ontology
  prefix: aro
  releases:
  - retrieved: '2021-02-02'
    version: 24-10-2019
  - retrieved: '2021-06-14'
    version: '2019-10-24'
  vtype: date
- name: Antibody Registry
  prefix: antibodyregistry
  releases:
  - homepage: https://antibodyregistry.org/
    retrieved: '2021-10-10'
    version: '3.0'
  vtype: semver_minor
- name: Apollo Structured Vocabulary
  prefix: apollosv
  releases:
  - retrieved: '2021-04-14'
    version: 4.1.1
  vtype: semver
- name: Apollo Structured Vocabulary (Apollo-SV)
  prefix: apollo_sv
  releases:
  - retrieved: '2021-02-02'
    version: v4.1.1
  - retrieved: '2021-02-04'
    version: 4.1.1
  vtype: semver
- name: Ascomycete phenotype ontology
  prefix: apo
  releases:
  - retrieved: '2021-02-02'
    version: '2020-03-10'
  - retrieved: '2022-04-27'
    version: '2022-03-23'
  - retrieved: '2022-05-10'
    version: '2022-04-19'
  vtype: date
- name: Bambara groundnut ontology
  prefix: co_366
  releases:
  - retrieved: '2021-02-02'
    version: 23-12-2019
  - retrieved: '2021-06-14'
    version: '2019-12-23'
  vtype: date
- name: Banana ontology
  prefix: co_325
  releases:
  - retrieved: '2021-02-02'
    version: 09-10-2019
  - retrieved: '2021-06-14'
    version: '2019-10-09'
  vtype: date
- name: Barley ontology
  prefix: co_323
  releases:
  - retrieved: '2021-02-02'
    version: 20-11-2019
  - retrieved: '2021-06-14'
    version: '2019-11-20'
  vtype: date
- name: Basic Formal Ontology
  prefix: bfo
  releases:
  - retrieved: '2021-02-02'
    version: '2019-08-26'
  vtype: date
- name: Beet Ontology ontology
  prefix: co_333
  releases:
  - retrieved: '2021-02-02'
    version: 23-01-2019
  - retrieved: '2021-06-14'
    version: '2019-01-23'
  vtype: date
- name: BiGG
  releases:
  - date: '2019-10-31'
    retrieved: '2021-11-09'
    version: 1.6.0
  vtype: semver
- name: BioAssay Ontology
  prefix: bao
  releases:
  - retrieved: '2021-02-02'
    version: '2.7'
  - retrieved: '2021-06-05'
    version: 2.7.1
  - retrieved: '2021-07-27'
    version: 2.7.2
  - retrieved: '2021-07-28'
    version: 2.7.1
  - retrieved: '2021-07-30'
    version: 2.7.2
  vtype: semver
- name: Biofacquim
  releases:
  - retrieved: '2021-01-03'
    version: '1.0'
  vtype: semver_minor
- name: BioGRID
  prefix: biogrid
  releases:
  - homepage: https://downloads.thebiogrid.org/BioGRID/Release-Archive/BIOGRID-4.2.192
    retrieved: '2020-12-11'
    version: 4.2.192
  - homepage: https://downloads.thebiogrid.org/BioGRID/Release-Archive/BIOGRID-4.2.193
    retrieved: '2021-01-02'
    version: 4.2.193
  - homepage: https://downloads.thebiogrid.org/BioGRID/Release-Archive/BIOGRID-4.3.194
    retrieved: '2021-02-02'
    version: 4.3.194
  - homepage: https://downloads.thebiogrid.org/BioGRID/Release-Archive/BIOGRID-4.3.195
    retrieved: '2021-03-02'
    version: 4.3.195
  - homepage: https://downloads.thebiogrid.org/BioGRID/Release-Archive/BIOGRID-4.3.196
    retrieved: '2021-04-02'
    version: 4.3.196
  - homepage: https://downloads.thebiogrid.org/BioGRID/Release-Archive/BIOGRID-4.4.197
    retrieved: '2021-05-02'
    version: 4.4.197
  - homepage: https://downloads.thebiogrid.org/BioGRID/Release-Archive/BIOGRID-4.4.198
    retrieved: '2021-06-02'
    version: 4.4.198
  - homepage: https://downloads.thebiogrid.org/BioGRID/Release-Archive/BIOGRID-4.4.199
    retrieved: '2021-07-02'
    version: 4.4.199
  - homepage: https://downloads.thebiogrid.org/BioGRID/Release-Archive/BIOGRID-4.4.200
    retrieved: '2021-08-02'
    version: 4.4.200
  - homepage: https://downloads.thebiogrid.org/BioGRID/Release-Archive/BIOGRID-4.4.201
    retrieved: '2021-09-08'
    version: 4.4.201
  - homepage: https://downloads.thebiogrid.org/BioGRID/Release-Archive/BIOGRID-4.4.202
    retrieved: '2021-10-02'
    version: 4.4.202
  - homepage: https://downloads.thebiogrid.org/BioGRID/Release-Archive/BIOGRID-4.4.203
    retrieved: '2021-11-02'
    version: 4.4.203
  - homepage: https://downloads.thebiogrid.org/BioGRID/Release-Archive/BIOGRID-4.4.204
    retrieved: '2021-12-02'
    version: 4.4.204
  - homepage: https://downloads.thebiogrid.org/BioGRID/Release-Archive/BIOGRID-4.4.205
    retrieved: '2022-01-02'
    version: 4.4.205
  - homepage: https://downloads.thebiogrid.org/BioGRID/Release-Archive/BIOGRID-4.4.206
    retrieved: '2022-02-02'
    version: 4.4.206
  - homepage: https://downloads.thebiogrid.org/BioGRID/Release-Archive/BIOGRID-4.4.207
    retrieved: '2022-03-03'
    version: 4.4.207
  - homepage: https://downloads.thebiogrid.org/BioGRID/Release-Archive/BIOGRID-4.4.208
    retrieved: '2022-04-02'
    version: 4.4.208
  - homepage: https://downloads.thebiogrid.org/BioGRID/Release-Archive/BIOGRID-4.4.209
    retrieved: '2022-05-02'
    version: 4.4.209
  vtype: semver
- name: Bioinformatics operations, data types, formats, identifiers and topics
  prefix: edam
  releases:
  - retrieved: '2021-04-14'
    version: 17-07-2019
  - retrieved: '2021-06-14'
    version: '2019-07-17'
  vtype: date
- name: Biological Collections Ontology
  prefix: bco
  releases:
  - retrieved: '2021-02-02'
    version: '2020-03-27'
  - retrieved: '2021-11-18'
    version: '2021-11-14'
  vtype: date
- name: Biological Imaging Methods Ontology
  prefix: fbbi
  releases:
  - retrieved: '2021-02-02'
    version: '2020-11-06'
  vtype: date
- name: Biological Spatial Ontology
  prefix: bspo
  releases:
  - retrieved: '2021-02-02'
    version: '2020-05-11'
  - retrieved: '2021-10-01'
    version: '2021-09-22'
  - retrieved: '2021-10-29'
    version: '2021-10-13'
  vtype: date
- name: Brachiaria ontology
  prefix: co_345
  releases:
  - retrieved: '2021-02-02'
    version: 09-10-2019
  - retrieved: '2021-06-14'
    version: '2019-10-09'
  vtype: date
- name: Brassica ontology
  prefix: co_348
  releases:
  - retrieved: '2021-02-02'
    version: 29-11-2019
  - retrieved: '2021-06-14'
    version: '2019-11-29'
  vtype: date
- name: BRENDA tissue / enzyme source
  prefix: bto
  releases:
  - retrieved: '2021-04-14'
    version: '2021-02-09'
  - retrieved: '2021-05-04'
    version: '2021-04-27'
  - retrieved: '2021-10-29'
    version: '2021-10-26'
  vtype: date
- name: Brenda Tissue Ontology
  prefix: bto
  releases:
  - retrieved: '2021-02-02'
    version: '2020-05-02'
  - retrieved: '2021-02-12'
    version: '2021-02-09'
  vtype: date
- name: C elegans Phenotype Ontology
  prefix: wbphenotype
  releases:
  - retrieved: '2021-02-02'
    version: '2020-12-15'
  - retrieved: '2021-02-12'
    version: '2021-02-08'
  - retrieved: '2021-02-25'
    version: '2021-02-18'
  - retrieved: '2021-03-03'
    version: '2021-03-01'
  - retrieved: '2021-03-08'
    version: '2021-03-05'
  - retrieved: '2021-03-12'
    version: '2021-03-10'
  - retrieved: '2021-04-13'
    version: '2021-04-09'
  vtype: date
- name: C. elegans Development Ontology
  prefix: wbls
  releases:
  - retrieved: '2021-02-02'
    version: '2020-12-15'
  - retrieved: '2021-02-12'
    version: '2021-02-09'
  - retrieved: '2021-04-13'
    version: '2021-04-09'
  vtype: date
- name: C. elegans development ontology
  prefix: wbls
  releases:
  - retrieved: '2021-04-14'
    version: '2021-04-09'
  - retrieved: '2021-07-27'
    version: '2021-07-06'
  - retrieved: '2021-12-11'
    version: '2021-12-08'
  - retrieved: '2022-03-28'
    version: '2022-03-22'
  vtype: date
- name: C. elegans Gross Anatomy Ontology
  prefix: wbbt
  releases:
  - retrieved: '2021-02-02'
    version: '2020-12-14'
  - retrieved: '2021-07-27'
    version: '2021-07-06'
  - retrieved: '2021-10-01'
    version: '2021-09-27'
  - retrieved: '2021-12-17'
    version: '2021-12-14'
  - retrieved: '2022-03-28'
    version: '2022-03-22'
  vtype: date
- name: C. elegans phenotype
  prefix: wbphenotype
  releases:
  - retrieved: '2021-04-14'
    version: '2021-04-09'
  - retrieved: '2021-05-07'
    version: '2021-05-05'
  - retrieved: '2021-05-08'
    version: '2021-05-06'
  - retrieved: '2021-05-29'
    version: '2021-05-27'
  - retrieved: '2021-06-04'
    version: '2021-06-01'
  - retrieved: '2021-07-27'
    version: '2021-07-06'
  - retrieved: '2021-10-01'
    version: '2021-09-27'
  - retrieved: '2021-10-29'
    version: '2021-10-25'
  - retrieved: '2021-12-14'
    version: '2021-12-12'
  - retrieved: '2022-01-11'
    version: '2021-12-20'
  - retrieved: '2022-03-28'
    version: '2022-03-22'
  vtype: date
- name: Cardiovascular Disease Ontology
  prefix: cvdo
  releases:
  - retrieved: '2021-02-02'
    version: '2020-03-05'
  vtype: date
- name: Cassava ontology
  prefix: co_334
  releases:
  - retrieved: '2021-02-02'
    version: 09-10-2019
  - retrieved: '2021-06-14'
    version: '2019-10-09'
  vtype: date
- name: Castor bean ontology
  prefix: co_347
  releases:
  - retrieved: '2021-02-02'
    version: 09-10-2019
  - retrieved: '2021-06-14'
    version: '2019-10-09'
  vtype: date
- name: Cell Cycle Ontology
  prefix: cco
  releases:
  - retrieved: '2021-02-02'
    version: 23-03-2016
  - retrieved: '2021-06-14'
    version: '2016-03-23'
  vtype: date
- name: Cell Line Ontology
  prefix: clo
  releases:
  - retrieved: '2021-04-14'
    version: 2.1.162
  - retrieved: '2022-03-26'
    version: 2.1.178
  vtype: semver
- name: Cell Ontology
  prefix: cl
  releases:
  - retrieved: '2020-12-22'
    version: '2020-11-11'
  - date: '2021-01-22'
    retrieved: '2021-01-24'
    version: '2021-01-22'
  - date: '2021-02-01'
    retrieved: '2021-02-02'
    version: '2021-02-01'
  - retrieved: '2021-04-14'
    version: '2021-03-05'
  - retrieved: '2021-04-24'
    version: '2021-04-22'
  - retrieved: '2021-06-25'
    version: '2021-06-21'
  - retrieved: '2021-07-27'
    version: '2021-06-29'
  - retrieved: '2021-09-08'
    version: '2021-08-10'
  - retrieved: '2021-09-09'
    version: '2021-06-29'
  - retrieved: '2021-09-15'
    version: '2021-08-10'
  - retrieved: '2021-09-19'
    version: '2021-09-09'
  - retrieved: '2021-11-27'
    version: '2021-11-23'
  - retrieved: '2021-12-04'
    version: '2021-11-25'
  - retrieved: '2021-12-09'
    version: '2021-12-07'
  - retrieved: '2022-01-11'
    version: '2022-01-05'
  - retrieved: '2022-03-03'
    version: '2022-02-16'
  vtype: date
- name: Cell Type Ontology
  prefix: cl
  releases:
  - retrieved: '2021-02-02'
    version: '2021-01-22'
  - retrieved: '2021-02-04'
    version: '2021-02-01'
  - retrieved: '2021-03-08'
    version: '2021-03-05'
  vtype: date
- name: Cellular Microscopy Phenotype Ontology
  prefix: cmpo
  releases:
  - retrieved: '2021-02-02'
    version: '2017-12-19'
  vtype: date
- name: Cephalopod Ontology
  prefix: ceph
  releases:
  - retrieved: '2021-02-02'
    version: '2016-01-12'
  vtype: date
- name: ChEBI
  prefix: chebi
  releases:
  - retrieved: '2020-12-11'
    version: '194'
  - homepage: ftp://ftp.ebi.ac.uk/pub/databases/chebi/archive/rel195/
    retrieved: '2021-01-02'
    version: '195'
  - homepage: ftp://ftp.ebi.ac.uk/pub/databases/chebi/archive/rel196/
    retrieved: '2021-02-02'
    version: '196'
  - homepage: ftp://ftp.ebi.ac.uk/pub/databases/chebi/archive/rel197/
    retrieved: '2021-03-02'
    version: '197'
  - homepage: ftp://ftp.ebi.ac.uk/pub/databases/chebi/archive/rel198/
    retrieved: '2021-04-02'
    version: '198'
  - homepage: ftp://ftp.ebi.ac.uk/pub/databases/chebi/archive/rel199/
    retrieved: '2021-05-02'
    version: '199'
  - homepage: ftp://ftp.ebi.ac.uk/pub/databases/chebi/archive/rel200/
    retrieved: '2021-06-02'
    version: '200'
  - homepage: ftp://ftp.ebi.ac.uk/pub/databases/chebi/archive/rel201/
    retrieved: '2021-07-02'
    version: '201'
  - homepage: ftp://ftp.ebi.ac.uk/pub/databases/chebi/archive/rel202/
    retrieved: '2021-08-02'
    version: '202'
  - homepage: ftp://ftp.ebi.ac.uk/pub/databases/chebi/archive/rel203/
    retrieved: '2021-09-08'
    version: '203'
  - homepage: ftp://ftp.ebi.ac.uk/pub/databases/chebi/archive/rel204/
    retrieved: '2021-10-14'
    version: '204'
  - homepage: ftp://ftp.ebi.ac.uk/pub/databases/chebi/archive/rel205/
    retrieved: '2021-11-04'
    version: '205'
  - homepage: ftp://ftp.ebi.ac.uk/pub/databases/chebi/archive/rel206/
    retrieved: '2021-12-02'
    version: '206'
  - homepage: ftp://ftp.ebi.ac.uk/pub/databases/chebi/archive/rel207/
    retrieved: '2022-01-02'
    version: '207'
  - homepage: ftp://ftp.ebi.ac.uk/pub/databases/chebi/archive/rel208/
    retrieved: '2022-02-02'
    version: '208'
  - homepage: ftp://ftp.ebi.ac.uk/pub/databases/chebi/archive/rel209/
    retrieved: '2022-03-11'
    version: '209'
  - homepage: ftp://ftp.ebi.ac.uk/pub/databases/chebi/archive/rel210/
    retrieved: '2022-04-05'
    version: '210'
  vtype: sequential
- name: ChEBI Integrated Role Ontology
  prefix: chiro
  releases:
  - retrieved: '2021-02-02'
    version: '2015-11-23'
  vtype: date
- name: ChEMBL
  prefix: chembl
  releases:
  - date: '2020-05-18'
    homepage: ftp://ftp.ebi.ac.uk/pub/databases/chembl/ChEMBLdb/releases/chembl_27
    retrieved: '2021-01-05'
    version: '27'
  - date: '2021-01-15'
    homepage: ftp://ftp.ebi.ac.uk/pub/databases/chembl/ChEMBLdb/releases/chembl_28
    retrieved: '2021-02-17'
    version: '28'
  - date: '2021-07-01'
    homepage: ftp://ftp.ebi.ac.uk/pub/databases/chembl/ChEMBLdb/releases/chembl_29
    retrieved: '2021-07-27'
    version: '29'
  - date: '2022-02-22'
    homepage: ftp://ftp.ebi.ac.uk/pub/databases/chembl/ChEMBLdb/releases/chembl_30
    retrieved: '2022-03-11'
    version: '30'
  vtype: sequential
- name: Chemical Information Ontology
  prefix: cheminf
  releases:
  - retrieved: '2021-02-02'
    version: 1.9.3
  - retrieved: '2021-03-09'
    version: '2.0'
  vtype: semver
- name: Chemical Methods Ontology
  prefix: chmo
  releases:
  - retrieved: '2021-02-02'
    version: 14-11-2019
  - retrieved: '2021-06-14'
    version: '2019-11-14'
  - retrieved: '2022-03-03'
    version: '2022-02-17'
  - retrieved: '2022-05-10'
    version: '2022-04-19'
  vtype: date
- name: ChemIDplus
  prefix: chemidplus
  releases:
  - date: '2021-06-24'
    homepage: https://ftp.nlm.nih.gov/projects/chemidlease/chem.xml.20210624.zip
    retrieved: '2021-09-30'
    version: '2021-06-24'
  - date: '2021-10-26'
    homepage: https://ftp.nlm.nih.gov/projects/chemidlease/chem.xml.20211026.zip
    retrieved: '2021-10-27'
    version: '2021-10-26'
  - date: '2022-05-12'
    homepage: https://ftp.nlm.nih.gov/projects/chemidlease/chem.xml.20220512.zip
    retrieved: '2022-05-14'
    version: '2022-05-12'
  vtype: date
- name: Chickpea ontology
  prefix: co_338
  releases:
  - retrieved: '2021-02-02'
    version: 09-10-2019
  - retrieved: '2021-06-14'
    version: '2019-10-09'
  vtype: date
- name: 'CIDO: Ontology of Coronavirus Infectious Disease'
  prefix: cido
  releases:
  - retrieved: '2021-02-02'
    version: 1.0.173
  - retrieved: '2021-02-04'
    version: 1.0.181
  - retrieved: '2021-02-19'
    version: 1.0.183
  - retrieved: '2021-02-25'
    version: 1.0.184
  - retrieved: '2021-03-09'
    version: 1.0.187
  vtype: semver
- name: clinical LABoratory Ontology
  prefix: labo
  releases:
  - retrieved: '2021-02-02'
    version: '2019-08-29'
  - retrieved: '2021-11-03'
    version: '2021-06-08'
  vtype: date
- name: Clinical measurement ontology
  prefix: cmo
  releases:
  - retrieved: '2021-02-02'
    version: '2019-02-19'
  vtype: date
- name: Clinical Trials Ontology
  prefix: cto
  releases:
  - retrieved: '2022-01-11'
    version: 1.0.0
  vtype: semver
- name: 'CLO: Cell Line Ontology'
  prefix: clo
  releases:
  - retrieved: '2021-02-02'
    version: 2.1.162
  vtype: semver
- name: Clytia hemisphaerica Development and Anatomy Ontology
  prefix: clyh
  releases:
  - retrieved: '2021-04-14'
    version: '2020-05-29'
  vtype: date
- name: Clytia hemisphaerica Development and Anatomy Ontology (CLYH)
  prefix: clyh
  releases:
  - retrieved: '2021-02-02'
    version: '2020-05-29'
  vtype: date
- name: Coleoptera Anatomy Ontology
  prefix: colao
  releases:
  - retrieved: '2022-01-04'
    version: '2021-12-14'
  vtype: date
- name: Collembola Anatomy Ontology
  prefix: clao
  releases:
  - retrieved: '2021-02-02'
    version: '2020-15-05'
  - retrieved: '2021-05-28'
    version: '2021-05-26'
  - retrieved: '2021-06-01'
    version: '2021-05-30'
  - retrieved: '2021-06-02'
    version: '2021-05-31'
  - retrieved: '2021-09-15'
    version: '2021-08-28'
  - retrieved: '2021-10-01'
    version: '2021-09-27'
  vtype: date
- name: Common Anatomy Reference Ontology
  prefix: caro
  releases:
  - retrieved: '2021-02-02'
    version: 24-05-2019
  - retrieved: '2021-06-14'
    version: '2019-05-24'
  - retrieved: '2022-03-03'
    version: '2022-02-18'
  vtype: date
- name: Common Bean ontology
  prefix: co_335
  releases:
  - retrieved: '2021-02-02'
    version: 09-10-2019
  - retrieved: '2021-06-14'
    version: '2019-10-09'
  vtype: date
- name: Comparative Data Analysis Ontology
  prefix: cdao
  releases:
  - retrieved: '2021-02-02'
    version: '2019-06-26'
  vtype: date
- name: Complex Portal
  prefix: complexportal
  releases:
  - homepage: ftp://ftp.ebi.ac.uk/pub/databases/intact/complex/2020-12-16/
    retrieved: '2020-12-25'
    version: '2020-12-16'
  - date: '2021-03-10'
    homepage: ftp://ftp.ebi.ac.uk/pub/databases/intact/complex/2021-03-10/
    retrieved: '2021-03-16'
    version: '2021-03-10'
  - date: '2021-05-05'
    homepage: ftp://ftp.ebi.ac.uk/pub/databases/intact/complex/2021-05-05/
    retrieved: '2021-05-18'
    version: '2021-05-05'
  - date: '2021-07-06'
    homepage: ftp://ftp.ebi.ac.uk/pub/databases/intact/complex/2021-07-06/
    retrieved: '2021-07-27'
    version: '2021-07-06'
  - date: '2021-10-13'
    homepage: ftp://ftp.ebi.ac.uk/pub/databases/intact/complex/2021-10-13/
    retrieved: '2021-10-19'
    version: '2021-10-13'
  - date: '2022-02-03'
    homepage: ftp://ftp.ebi.ac.uk/pub/databases/intact/complex/2022-02-03/
    retrieved: '2022-02-08'
    version: '2022-02-03'
  vtype: date
- name: Compositional Dietary Nutrition Ontology
  prefix: cdno
  releases:
  - retrieved: '2021-05-28'
    version: '2021-02-06'
  - retrieved: '2021-06-03'
    version: '2021-05-30'
  - retrieved: '2021-09-15'
    version: '2021-09-09'
  - retrieved: '2021-10-29'
    version: '2021-10-20'
  - retrieved: '2022-01-13'
    version: '2022-01-10'
  - retrieved: '2022-04-12'
    version: '2022-04-06'
  vtype: date
- name: Confidence Information Ontology
  prefix: cio
  releases:
  - retrieved: '2021-02-02'
    version: '2015-03-10'
  vtype: date
- name: Contributor Role Ontology
  prefix: cro
  releases:
  - retrieved: '2021-02-02'
    version: '2019-12-11'
  vtype: date
- name: Core Ontology for Biology and Biomedicine
  prefix: cob
  releases:
  - retrieved: '2021-02-02'
    version: '2020-09-02'
  - retrieved: '2021-03-02'
    version: '2021-02-21'
  - retrieved: '2021-09-15'
    version: '2021-09-11'
  - retrieved: '2021-09-19'
    version: '2021-09-13'
  - retrieved: '2022-05-10'
    version: '2022-05-02'
  vtype: date
- name: Coronavirus Infectious Disease Ontology
  prefix: cido
  releases:
  - retrieved: '2021-04-14'
    version: 1.0.187
  - retrieved: '2021-05-12'
    version: 1.0.211
  - retrieved: '2021-06-14'
    version: 1.0.214
  - retrieved: '2021-07-30'
    version: 1.0.235
  - retrieved: '2021-09-08'
    version: 1.0.255
  - retrieved: '2021-09-09'
    version: 1.0.235
  - retrieved: '2021-09-15'
    version: 1.0.259
  - retrieved: '2022-03-03'
    version: 1.0.281
  - retrieved: '2022-05-24'
    version: 1.0.326
  vtype: semver
- name: Cotton ontology
  prefix: co_358
  releases:
  - retrieved: '2021-02-02'
    version: 03-01-2020
  - retrieved: '2021-06-14'
    version: '2020-01-03'
  vtype: date
- name: CoVoc Coronavirus Vocabulary
  prefix: covoc
  releases:
  - retrieved: '2021-02-02'
    version: '2020-08-28'
  vtype: date
- name: Cowpea ontology
  prefix: co_340
  releases:
  - retrieved: '2021-02-02'
    version: 09-10-2019
  - retrieved: '2021-06-14'
    version: '2019-10-09'
  vtype: date
- name: Crop Dietary Nutrition Ontology
  prefix: cdno
  releases:
  - retrieved: '2021-03-02'
    version: '2021-02-06'
  vtype: date
- name: Cryo Electron Microscopy ontology
  prefix: cryoem
  releases:
  - retrieved: '2021-03-29'
    version: '2021-03-09'
  vtype: date
- name: Ctenophore Ontology
  prefix: cteno
  releases:
  - retrieved: '2021-02-02'
    version: '2016-10-19'
  vtype: date
- name: 'CTO: Core Ontology of Clinical Trials'
  prefix: cto
  releases:
  - retrieved: '2021-02-02'
    version: 'Version Release: 1.0.0'
  - retrieved: '2021-02-04'
    version: 1.0.0
  vtype: semver
- name: Data Use Ontology
  prefix: duo
  releases:
  - retrieved: '2021-02-02'
    version: '2020-02-03'
  - retrieved: '2021-02-25'
    version: '2021-02-23'
  vtype: date
- name: DepMap
  releases:
  - retrieved: '2021-11-16'
    version: 21Q4
  - retrieved: '2022-02-15'
    version: 22Q1
  - retrieved: '2022-05-10'
    version: 22Q2
  vtype: other
- name: DICOM Controlled Terminology
  prefix: dicom
  releases:
  - retrieved: '2021-02-02'
    version: 2021a_20210130
  - retrieved: '2021-11-03'
    version: 2021d_20210910
  - retrieved: '2021-11-27'
    version: 2021e_20211122
  vtype: other
- name: Dicty Phenotype Ontology (DDPHENO)
  prefix: ddpheno
  releases:
  - retrieved: '2021-02-02'
    version: '2020-06-19'
  vtype: date
- name: Dictyostelium discoideum anatomy
  prefix: ddanat
  releases:
  - retrieved: '2021-02-02'
    version: '2020-04-13'
  vtype: date
- name: Dictyostelium discoideum phenotype ontology
  prefix: ddpheno
  releases:
  - retrieved: '2021-04-14'
    version: '2020-06-19'
  vtype: date
- name: Disease Ontology
  prefix: doid
  releases:
  - homepage: https://github.com/DiseaseOntology/HumanDiseaseOntology/tree/main/src/ontology/releases/2020-12-02
    retrieved: '2020-12-11'
    version: '2020-12-02'
  - homepage: https://github.com/DiseaseOntology/HumanDiseaseOntology/tree/main/src/ontology/releases/2020-12-21
    retrieved: '2020-12-22'
    version: '2020-12-21'
  - homepage: https://github.com/DiseaseOntology/HumanDiseaseOntology/tree/main/src/ontology/releases/2020-12-22
    retrieved: '2020-12-23'
    version: '2020-12-22'
  - date: '2021-01-28'
    homepage: https://github.com/DiseaseOntology/HumanDiseaseOntology/tree/main/src/ontology/releases/2021-01-28
    retrieved: '2021-01-29'
    version: '2021-01-28'
  - date: '2021-02-24'
    homepage: https://github.com/DiseaseOntology/HumanDiseaseOntology/tree/main/src/ontology/releases/2021-02-24
    retrieved: '2021-02-26'
    version: '2021-02-24'
  - date: '2021-03-29'
    homepage: https://github.com/DiseaseOntology/HumanDiseaseOntology/tree/main/src/ontology/releases/2021-03-29
    retrieved: '2021-03-30'
    version: '2021-03-29'
  - date: '2021-04-29'
    homepage: https://github.com/DiseaseOntology/HumanDiseaseOntology/tree/main/src/ontology/releases/2021-04-29
    retrieved: '2021-04-30'
    version: '2021-04-29'
  - date: '2021-06-03'
    homepage: https://github.com/DiseaseOntology/HumanDiseaseOntology/tree/main/src/ontology/releases/2021-06-03
    retrieved: '2021-06-04'
    version: '2021-06-03'
  - date: '2021-06-08'
    homepage: https://github.com/DiseaseOntology/HumanDiseaseOntology/tree/main/src/ontology/releases/2021-06-08
    retrieved: '2021-06-14'
    version: '2021-06-08'
  - date: '2021-07-29'
    homepage: https://github.com/DiseaseOntology/HumanDiseaseOntology/tree/main/src/ontology/releases/2021-07-29
    retrieved: '2021-07-30'
    version: '2021-07-29'
  - date: '2021-08-17'
    homepage: https://github.com/DiseaseOntology/HumanDiseaseOntology/tree/main/src/ontology/releases/2021-08-17
    retrieved: '2021-09-08'
    version: '2021-08-17'
  - date: '2021-10-01'
    homepage: https://github.com/DiseaseOntology/HumanDiseaseOntology/tree/main/src/ontology/releases/2021-10-01
    retrieved: '2021-10-02'
    version: '2021-10-01'
  - date: '2021-10-11'
    homepage: https://github.com/DiseaseOntology/HumanDiseaseOntology/tree/main/src/ontology/releases/2021-10-11
    retrieved: '2021-10-12'
    version: '2021-10-11'
  - date: '2021-10-12'
    homepage: https://github.com/DiseaseOntology/HumanDiseaseOntology/tree/main/src/ontology/releases/2021-10-12
    retrieved: '2021-10-13'
    version: '2021-10-12'
  - date: '2021-11-16'
    homepage: https://github.com/DiseaseOntology/HumanDiseaseOntology/tree/main/src/ontology/releases/2021-11-16
    retrieved: '2021-11-17'
    version: '2021-11-16'
  - date: '2021-11-17'
    homepage: https://github.com/DiseaseOntology/HumanDiseaseOntology/tree/main/src/ontology/releases/2021-11-17
    retrieved: '2021-11-18'
    version: '2021-11-17'
  - date: '2021-12-15'
    homepage: https://github.com/DiseaseOntology/HumanDiseaseOntology/tree/main/src/ontology/releases/2021-12-15
    retrieved: '2021-12-16'
    version: '2021-12-15'
  - date: '2022-01-31'
    homepage: https://github.com/DiseaseOntology/HumanDiseaseOntology/tree/main/src/ontology/releases/2022-01-31
    retrieved: '2022-02-01'
    version: '2022-01-31'
  - date: '2022-03-02'
    homepage: https://github.com/DiseaseOntology/HumanDiseaseOntology/tree/main/src/ontology/releases/2022-03-02
    retrieved: '2022-03-03'
    version: '2022-03-02'
  - date: '2022-04-01'
    homepage: https://github.com/DiseaseOntology/HumanDiseaseOntology/tree/main/src/ontology/releases/2022-04-01
    retrieved: '2022-04-02'
    version: '2022-04-01'
  - date: '2022-04-28'
    homepage: https://github.com/DiseaseOntology/HumanDiseaseOntology/tree/main/src/ontology/releases/2022-04-28
    retrieved: '2022-04-29'
    version: '2022-04-28'
  vtype: date
- name: DisGeNet
  releases:
  - date: '2021-02-01'
    retrieved: '2021-03-06'
    version: '7'
  vtype: sequential
- name: Drosophila Anatomy Ontology (DAO)
  prefix: fbbt
  releases:
  - retrieved: '2021-02-02'
    version: '2021-01-14'
  - retrieved: '2021-03-13'
    version: '2021-03-11'
  vtype: date
- name: Drosophila development
  prefix: fbdv
  releases:
  - retrieved: '2021-04-14'
    version: '2021-03-10'
  - retrieved: '2021-05-12'
    version: '2021-05-10'
  - retrieved: '2021-07-27'
    version: '2021-07-05'
  - retrieved: '2021-09-15'
    version: '2021-09-01'
  - retrieved: '2021-10-29'
    version: '2021-10-13'
  - retrieved: '2021-12-09'
    version: '2021-12-06'
  - retrieved: '2022-03-03'
    version: '2022-02-25'
  - retrieved: '2022-04-27'
    version: '2022-04-12'
  vtype: date
- name: Drosophila gross anatomy
  prefix: fbbt
  releases:
  - retrieved: '2021-04-14'
    version: '2021-03-11'
  - retrieved: '2021-05-14'
    version: '2021-05-11'
  - retrieved: '2021-07-27'
    version: '2021-07-09'
  - retrieved: '2021-11-03'
    version: '2021-10-14'
  - retrieved: '2022-02-03'
    version: '2022-01-27'
  - retrieved: '2022-03-03'
    version: '2022-02-24'
  - retrieved: '2022-04-27'
    version: '2022-04-13'
  vtype: date
- name: Drosophila Phenotype Ontology
  prefix: dpo
  releases:
  - retrieved: '2021-04-14'
    version: '2021-03-11'
  - retrieved: '2021-05-14'
    version: '2021-05-12'
  - retrieved: '2021-07-27'
    version: '2021-07-15'
  - retrieved: '2021-07-28'
    version: '2021-07-09'
  - retrieved: '2021-07-30'
    version: '2021-07-15'
  - retrieved: '2021-09-15'
    version: '2021-09-02'
  - retrieved: '2021-10-29'
    version: '2021-10-15'
  - retrieved: '2021-12-14'
    version: '2021-12-10'
  - retrieved: '2022-03-03'
    version: '2022-02-24'
  - retrieved: '2022-04-27'
    version: '2022-04-13'
  vtype: date
- name: Drosophila Phenotype Ontology (DPO)
  prefix: dpo
  releases:
  - retrieved: '2021-02-02'
    version: '2021-01-14'
  - retrieved: '2021-03-13'
    version: '2021-03-11'
  vtype: date
- name: Drug Gene Interaction Database
  releases:
  - date: '2020-11-01'
    retrieved: '2021-03-30'
    version: 2020-Nov
  - date: '2022-02-01'
    retrieved: '2022-02-03'
    version: 2022-Feb
  vtype: month
- name: Drug-drug Interaction and Drug-drug Interaction Evidence Ontology
  prefix: dideo
  releases:
  - retrieved: '2021-02-02'
    version: release version 2019-01-30
  - retrieved: '2021-02-04'
    version: '2019-01-30'
  - retrieved: '2021-06-25'
    version: '2021-06-11'
  vtype: date
- name: DrugBank
  prefix: drugbank
  releases:
  - date: '2020-07-02'
    homepage: https://go.drugbank.com/releases/5-1-7
    retrieved: '2020-12-23'
    version: 5.1.7
  - date: '2021-01-03'
    homepage: https://go.drugbank.com/releases/5-1-8
    retrieved: '2021-01-04'
    version: 5.1.8
  - date: '2022-01-04'
    homepage: https://go.drugbank.com/releases/5-1-9
    retrieved: '2022-01-05'
    version: 5.1.9
  vtype: semver
- name: DrugCentral
  prefix: drugcentral
  releases:
  - retrieved: '2020-12-22'
    version: 9/18/2020
  - date: '2021-10-05'
    retrieved: '2021-10-06'
    version: 10/05/2021
  - date: '2021-09-01'
    homepage: https://unmtid-shinyapps.net/download/DrugCentral/2021_09_01
    retrieved: '2021-11-22'
    version: '2021_09_01'
  vtype: date
- name: eagle-i resource ontology
  prefix: ero
  releases:
  - retrieved: '2021-02-02'
    version: 27-07-2016
  - retrieved: '2021-06-14'
    version: '2016-07-27'
  vtype: date
- name: Echinoderm Anatomy and Development Ontology
  prefix: ecao
  releases:
  - retrieved: '2021-02-02'
    version: '2020-05-22'
  vtype: date
- name: EDAM Ontology
  prefix: edam
  releases:
  - retrieved: '2021-02-02'
    version: 17-07-2019
  vtype: date
- name: Emotion Ontology
  prefix: mfoem
  releases:
  - retrieved: '2021-02-02'
    version: '2020-05-13'
  - retrieved: '2021-03-10'
    version: '2021-03-09'
  - retrieved: '2021-04-14'
    version: '2021-04-12'
  - retrieved: '2021-07-27'
    version: '2021-07-06'
  - retrieved: '2021-10-01'
    version: '2021-09-21'
  - retrieved: '2021-11-20'
    version: '2021-11-17'
  vtype: date
- name: eNanoMapper Ontology
  prefix: enm
  releases:
  - retrieved: '2021-02-02'
    version: 5.0.1
  - retrieved: '2021-06-25'
    version: '7.2'
  - retrieved: '2022-04-27'
    version: '7.3'
  vtype: semver
- name: Ensembl
  prefix: ensembl
  releases:
  - date: '2021-05-01'
    homepage: https://www.ensembl.org
    retrieved: '2021-10-11'
    version: '104'
  - date: '2021-11-01'
    homepage: https://www.ensembl.org
    retrieved: '2021-12-09'
    version: '105'
  - date: '2022-04-01'
    homepage: https://www.ensembl.org
    retrieved: '2022-04-12'
    version: '106'
  vtype: sequential
- name: Ensembl Glossary
  prefix: ensemblglossary
  releases:
  - retrieved: '2021-02-02'
    version: '2020-12-10'
  - retrieved: '2021-02-17'
    version: '2021-02-15'
  - retrieved: '2021-03-18'
    version: '2021-03-16'
  - retrieved: '2021-04-21'
    version: '2021-04-19'
  - retrieved: '2021-04-29'
    version: '2021-04-26'
  - retrieved: '2021-07-27'
    version: '2021-07-14'
  - retrieved: '2021-07-28'
    version: '2021-04-26'
  - retrieved: '2021-07-30'
    version: '2021-07-14'
  vtype: date
- name: Environment Exposure Ontology
  prefix: ecto
  releases:
  - retrieved: '2021-02-02'
    version: '2020-09-18'
  - retrieved: '2021-03-29'
    version: '2021-03-17'
  vtype: date
- name: Environment Ontology
  prefix: envo
  releases:
  - retrieved: '2021-02-02'
    version: '2020-06-10'
  - retrieved: '2021-05-21'
    version: '2021-05-14'
  vtype: date
- name: Environment Ontology for Livestock
  prefix: eol
  releases:
  - retrieved: '2021-02-02'
    version: 13-09-2018
  - retrieved: '2021-06-14'
    version: '2018-09-13'
  vtype: date
- name: Environmental conditions, treatments and exposures ontology
  prefix: ecto
  releases:
  - retrieved: '2021-04-14'
    version: '2021-03-17'
  - retrieved: '2021-10-04'
    version: '2021-08-25'
  - retrieved: '2021-10-04'
    version: '2021-03-17'
  - retrieved: '2021-10-09'
    version: '2021-08-25'
  vtype: date
- name: Evidence Code Ontology
  prefix: eco
  releases:
  - retrieved: '2021-02-02'
    version: '2021-01-08'
  - retrieved: '2021-02-12'
    version: '2021-02-08'
  - retrieved: '2021-03-08'
    version: '2021-03-05'
  vtype: date
- name: Evidence ontology
  prefix: eco
  releases:
  - retrieved: '2021-04-14'
    version: '2021-03-05'
  - retrieved: '2021-05-12'
    version: '2021-05-07'
  - retrieved: '2021-06-14'
    version: '2021-06-04'
  - retrieved: '2021-07-27'
    version: '2021-07-02'
  - retrieved: '2021-09-08'
    version: '2021-08-12'
  - retrieved: '2021-09-09'
    version: '2021-07-02'
  - retrieved: '2021-09-15'
    version: '2021-08-12'
  - retrieved: '2021-09-19'
    version: '2021-09-14'
  - retrieved: '2021-10-15'
    version: '2021-10-08'
  - retrieved: '2021-10-29'
    version: '2021-10-20'
  - retrieved: '2021-12-08'
    version: '2021-12-03'
  - retrieved: '2022-02-05'
    version: '2022-01-04'
  - retrieved: '2022-03-03'
    version: '2022-02-09'
  - retrieved: '2022-04-27'
    version: '2022-04-11'
  vtype: date
- name: ExPASy
  prefix: eccode
  releases:
  - retrieved: '2021-01-02'
    version: 02-Dec-2020
  - date: '2021-02-10'
    retrieved: '2021-02-12'
    version: 10-Feb-2021
  - date: '2021-04-07'
    retrieved: '2021-04-09'
    version: 07-Apr-2021
  - date: '2021-06-02'
    retrieved: '2021-06-25'
    version: 02-Jun-2021
  - date: '2021-09-29'
    retrieved: '2021-11-18'
    version: 29-Sep-2021
  - date: '2022-02-23'
    retrieved: '2022-03-03'
    version: 23-Feb-2022
  vtype: date
- name: Experimental condition ontology
  prefix: xco
  releases:
  - retrieved: '2021-02-02'
    version: 18-12-2019
  - retrieved: '2021-06-14'
    version: '2019-12-18'
  vtype: date
- name: Experimental Factor Ontology
  prefix: efo
  releases:
  - retrieved: '2021-02-02'
    version: 3.26.0
  - retrieved: '2021-02-17'
    version: 3.27.0
  - retrieved: '2021-03-16'
    version: 3.28.0
  - retrieved: '2021-04-18'
    version: 3.29.0
  - retrieved: '2021-04-23'
    version: 3.29.1
  - retrieved: '2021-05-19'
    version: 3.30.0
  - retrieved: '2021-06-25'
    version: 3.31.0
  - retrieved: '2021-07-27'
    version: 3.32.0
  - retrieved: '2021-07-28'
    version: 3.31.0
  - retrieved: '2021-07-30'
    version: 3.32.0
  - retrieved: '2021-09-08'
    version: 3.33.0
  - retrieved: '2021-09-09'
    version: 3.32.0
  - retrieved: '2021-09-15'
    version: 3.33.0
  - retrieved: '2021-09-19'
    version: 3.34.0
  - retrieved: '2021-10-29'
    version: 3.35.0
  - retrieved: '2021-11-17'
    version: 3.31.0
  - retrieved: '2021-11-18'
    version: 3.36.0
  - retrieved: '2022-01-11'
    version: 3.37.0
  - retrieved: '2022-01-23'
    version: 3.38.0
  - retrieved: '2022-03-03'
    version: 3.39.1
  - retrieved: '2022-03-26'
    version: 3.40.0
  - retrieved: '2022-05-10'
    version: 3.41.0
  - retrieved: '2022-05-19'
    version: 3.42.0
  vtype: semver
- name: Exposure ontology
  prefix: exo
  releases:
  - retrieved: '2021-02-02'
    version: '2020-03-10'
  vtype: date
- name: Fababean ontology
  prefix: co_365
  releases:
  - retrieved: '2021-02-02'
    version: 15-10-2019
  - retrieved: '2021-06-14'
    version: '2019-10-15'
  vtype: date
- name: FAIRsharing Subject Ontology
  prefix: srao
  releases:
  - retrieved: '2021-11-14'
    version: 0.2.2
  - retrieved: '2021-11-21'
    version: 0.3.0
  vtype: semver
- name: Fission Yeast Phenotype Ontology
  prefix: fypo
  releases:
  - retrieved: '2021-02-02'
    version: '2021-01-27'
  - retrieved: '2021-02-04'
    version: '2021-02-01'
  - retrieved: '2021-02-12'
    version: '2021-02-10'
  - retrieved: '2021-02-16'
    version: '2021-02-11'
  - retrieved: '2021-02-19'
    version: '2021-02-17'
  - retrieved: '2021-02-25'
    version: '2021-02-23'
  - retrieved: '2021-03-04'
    version: '2021-03-02'
  - retrieved: '2021-03-11'
    version: '2021-03-09'
  - retrieved: '2021-03-12'
    version: '2021-03-10'
  - retrieved: '2021-03-18'
    version: '2021-03-16'
  - retrieved: '2021-03-29'
    version: '2021-03-23'
  - retrieved: '2021-04-01'
    version: '2021-03-30'
  - retrieved: '2021-04-14'
    version: '2021-04-12'
  - retrieved: '2021-04-15'
    version: '2021-04-13'
  - retrieved: '2021-04-21'
    version: '2021-04-19'
  - retrieved: '2021-04-23'
    version: '2021-04-21'
  - retrieved: '2021-04-29'
    version: '2021-04-26'
  - retrieved: '2021-05-07'
    version: '2021-05-05'
  - retrieved: '2021-05-14'
    version: '2021-05-11'
  - retrieved: '2021-05-15'
    version: '2021-05-13'
  - retrieved: '2021-05-25'
    version: '2021-05-20'
  - retrieved: '2021-06-05'
    version: '2021-06-03'
  - retrieved: '2021-06-14'
    version: '2021-06-09'
  - retrieved: '2021-06-25'
    version: '2021-06-17'
  - retrieved: '2021-07-27'
    version: '2021-07-21'
  - retrieved: '2021-07-28'
    version: '2021-07-06'
  - retrieved: '2021-07-30'
    version: '2021-07-21'
  - retrieved: '2021-09-15'
    version: '2021-09-02'
  - retrieved: '2021-09-19'
    version: '2021-09-16'
  - retrieved: '2021-10-01'
    version: '2021-09-28'
  - retrieved: '2021-10-15'
    version: '2021-10-05'
  - retrieved: '2021-11-11'
    version: '2021-11-08'
  - retrieved: '2021-11-19'
    version: '2021-11-16'
  - retrieved: '2021-11-21'
    version: '2021-11-18'
  - retrieved: '2021-12-05'
    version: '2021-12-02'
  - retrieved: '2021-12-09'
    version: '2021-12-07'
  - retrieved: '2022-01-23'
    version: '2022-01-18'
  - retrieved: '2022-02-03'
    version: '2022-01-27'
  - retrieved: '2022-05-10'
    version: '2022-04-28'
  vtype: date
- name: Flora Phenotype Ontology
  prefix: flopo
  releases:
  - retrieved: '2021-02-02'
    version: 09-09-2019
  - retrieved: '2021-06-14'
    version: '2019-09-09'
  vtype: date
- name: FlyBase
  prefix: flybase
  releases:
  - homepage: http://ftp.flybase.net/releases/FB2021_04/
    retrieved: '2021-09-16'
    version: '2021_04'
  - homepage: http://ftp.flybase.net/releases/FB2021_05/
    retrieved: '2021-10-16'
    version: '2021_05'
  - homepage: http://ftp.flybase.net/releases/FB2021_06/
    retrieved: '2021-12-16'
    version: '2021_06'
  - homepage: http://ftp.flybase.net/releases/FB2022_01/
    retrieved: '2022-02-09'
    version: '2022_01'
  - homepage: http://ftp.flybase.net/releases/FB2022_02/
    retrieved: '2022-03-30'
    version: '2022_02'
  vtype: date
- name: FlyBase Controlled Vocabulary
  prefix: fbcv
  releases:
  - retrieved: '2021-04-14'
    version: '2021-03-11'
  - retrieved: '2021-05-14'
    version: '2021-05-12'
  - retrieved: '2021-07-27'
    version: '2021-07-15'
  - retrieved: '2021-07-28'
    version: '2021-05-12'
  - retrieved: '2021-07-30'
    version: '2021-07-15'
  - retrieved: '2021-09-15'
    version: '2021-09-02'
  - retrieved: '2021-10-29'
    version: '2021-10-18'
  - retrieved: '2021-12-16'
    version: '2021-12-13'
  - retrieved: '2022-03-03'
    version: '2022-02-24'
  - retrieved: '2022-04-27'
    version: '2022-04-14'
  vtype: date
- name: FlyBase Controlled Vocabulary (FBcv)
  prefix: fbcv
  releases:
  - retrieved: '2021-02-02'
    version: '2021-01-14'
  - retrieved: '2021-03-13'
    version: '2021-03-11'
  vtype: date
- name: FlyBase Developmental Ontology (FBdv)
  prefix: fbdv
  releases:
  - retrieved: '2021-02-02'
    version: '2021-01-13'
  - retrieved: '2021-03-12'
    version: '2021-03-10'
  vtype: date
- name: FMA
  prefix: fma
  releases:
  - retrieved: '2021-02-02'
    version: '2020-04-13'
  vtype: date
- name: FoodOn Food Ontology
  prefix: foodon
  releases:
  - retrieved: '2021-02-02'
    version: '2020-12-04'
  - retrieved: '2021-02-12'
    version: '2021-02-03'
  - retrieved: '2021-03-13'
    version: '2021-03-11'
  - retrieved: '2021-03-29'
    version: '2021-03-20'
  vtype: date
- name: Foundational Model of Anatomy
  prefix: fma
  releases:
  - retrieved: '2021-04-14'
    version: '2020-04-13'
  vtype: date
- name: Fungal gross anatomy
  prefix: fao
  releases:
  - retrieved: '2021-02-02'
    version: '2020-05-07'
  vtype: date
- name: FuTRES Ontology of Vertebrate Traits
  prefix: fovt
  releases:
  - retrieved: '2021-02-02'
    version: '2020-06-08'
  - retrieved: '2021-03-05'
    version: '2021-03-03'
  - retrieved: '2021-06-04'
    version: '2021-06-02'
  - retrieved: '2021-11-03'
    version: '2021-10-29'
  - retrieved: '2021-11-13'
    version: '2021-11-10'
  vtype: date
- name: Gazetteer
  prefix: gaz
  releases:
  - retrieved: '2021-02-02'
    version: 26-06-2018
  - retrieved: '2021-06-14'
    version: '2018-06-26'
  vtype: date
- name: Gender, Sex, and Sexual Orientation Ontology
  prefix: gsso
  releases:
  - retrieved: '2021-11-14'
    version: 2.0.5
  vtype: semver
- name: Gene Expression Ontology
  prefix: gexo
  releases:
  - retrieved: '2021-02-02'
    version: 18-09-2019
  - retrieved: '2021-06-14'
    version: '2019-09-18'
  vtype: date
- name: Gene Ontology
  prefix: go
  releases:
  - retrieved: '2020-12-11'
    version: '2020-11-18'
  - retrieved: '2020-12-22'
    version: '2020-12-08'
  - date: '2021-01-01'
    homepage: http://archive.geneontology.org/full/2021-01-01/
    retrieved: '2021-01-14'
    version: '2021-01-01'
  - date: '2021-02-01'
    homepage: http://archive.geneontology.org/full/2021-02-01/
    retrieved: '2021-02-04'
    version: '2021-02-01'
  - date: '2021-05-01'
    homepage: http://archive.geneontology.org/full/2021-05-01/
    retrieved: '2021-05-04'
    version: '2021-05-01'
  - date: '2021-06-16'
    homepage: http://archive.geneontology.org/full/2021-06-16/
    retrieved: '2021-06-25'
    version: '2021-06-16'
  - date: '2021-07-02'
    homepage: http://archive.geneontology.org/full/2021-07-02/
    retrieved: '2021-07-08'
    version: '2021-07-02'
  - date: '2021-09-01'
    homepage: http://archive.geneontology.org/full/2021-09-01/
    retrieved: '2021-09-08'
    version: '2021-09-01'
  - date: '2021-10-26'
    homepage: http://archive.geneontology.org/full/2021-10-26/
    retrieved: '2021-10-29'
    version: '2021-10-26'
  - date: '2021-11-16'
    homepage: http://archive.geneontology.org/full/2021-11-16/
    retrieved: '2021-11-25'
    version: '2021-11-16'
  - date: '2021-12-15'
    homepage: http://archive.geneontology.org/full/2021-12-15/
    retrieved: '2021-12-18'
    version: '2021-12-15'
  - date: '2022-01-13'
    homepage: http://archive.geneontology.org/full/2022-01-13/
    retrieved: '2022-01-19'
    version: '2022-01-13'
  - date: '2022-03-10'
    homepage: http://archive.geneontology.org/full/2022-03-10/
    retrieved: '2022-03-17'
    version: '2022-03-10'
  - date: '2022-03-22'
    homepage: http://archive.geneontology.org/full/2022-03-22/
    retrieved: '2022-03-31'
    version: '2022-03-22'
  - date: '2022-05-16'
    homepage: http://archive.geneontology.org/full/2022-05-16/
    retrieved: '2022-05-21'
    version: '2022-05-16'
  vtype: date
- name: GENO ontology
  prefix: geno
  releases:
  - retrieved: '2021-02-02'
    version: '2020-03-08'
  vtype: date
- name: Genomic Epidemiology Ontology
  prefix: genepio
  releases:
  - retrieved: '2021-02-02'
    version: '2020-08-09'
  - retrieved: '2021-05-28'
    version: '2021-05-24'
  - retrieved: '2022-02-03'
    version: '2022-01-29'
  - retrieved: '2022-03-03'
    version: '2022-02-06'
  vtype: date
- name: Genomics Cohorts Knowledge Ontology
  prefix: gecko
  releases:
  - retrieved: '2021-02-02'
    version: '2021-01-18'
  vtype: date
- name: Genotype Ontology
  prefix: geno
  releases:
  - retrieved: '2021-04-14'
    version: '2020-03-08'
  - retrieved: '2022-04-27'
    version: '2022-03-05'
  vtype: date
- name: GEO
  prefix: geo
  releases:
  - retrieved: '2021-02-02'
    version: production version 2016-03-26
  - retrieved: '2021-02-04'
    version: '2016-03-26'
  vtype: date
- name: Geographical Entity Ontology
  prefix: geogeo
  releases:
  - retrieved: '2021-04-14'
    version: '2016-03-26'
  vtype: date
- name: Glycan Naming and Subsumption Ontology
  prefix: gno
  releases:
  - retrieved: '2021-07-30'
    version: 1.7.2
  - retrieved: '2021-09-08'
    version: 1.9.0
  - retrieved: '2021-09-09'
    version: 1.7.2
  - retrieved: '2021-09-15'
    version: 1.9.0
  - retrieved: '2022-03-03'
    version: 1.10.0
  vtype: semver
- name: Glycan Naming and Subsumption Ontology (GNOme)
  prefix: gno
  releases:
  - retrieved: '2021-04-14'
    version: 1.7.0
  - retrieved: '2021-05-14'
    version: 1.7.1
  - retrieved: '2021-06-25'
    version: 1.7.2
  vtype: semver
- name: Glycan Naming Ontology
  prefix: gno
  releases:
  - retrieved: '2021-02-02'
    version: V1.6.3
  - retrieved: '2021-02-04'
    version: 1.6.3
  - retrieved: '2021-03-08'
    version: 1.7.0
  vtype: semver
- name: Groundnut ontology
  prefix: co_337
  releases:
  - retrieved: '2021-02-02'
    version: 09-10-2019
  - retrieved: '2021-06-14'
    version: '2019-10-09'
  vtype: date
- name: Guide to Pharmacology
  releases:
  - date: '2021-09-02'
    homepage: https://www.guidetopharmacology.org/DATA/public_iuphardb_v2021.3.zip
    retrieved: '2021-10-04'
    version: '2021.3'
  - date: '2021-12-14'
    homepage: https://www.guidetopharmacology.org/DATA/public_iuphardb_v2021.4.zip
    retrieved: '2021-12-15'
    version: '2021.4'
  - date: '2022-03-31'
    homepage: https://www.guidetopharmacology.org/DATA/public_iuphardb_v2022.1.zip
    retrieved: '2022-04-01'
    version: '2022.1'
  vtype: year_minor
- name: Health Surveillance Ontology
  prefix: hso
  releases:
  - retrieved: '2021-02-02'
    version: '2020-11-28'
  - retrieved: '2021-12-16'
    version: '2021-12-13'
  vtype: date
- name: Histopathology Ontology
  prefix: hpath
  releases:
  - retrieved: '2021-02-02'
    version: 05-07-2019
  - retrieved: '2021-06-14'
    version: '2019-07-05'
  vtype: date
- name: HomoloGene
  prefix: homologene
  releases:
  - retrieved: '2021-03-02'
    version: '68'
  vtype: sequential
- name: Homology Ontology
  prefix: hom
  releases:
  - retrieved: '2021-02-02'
    version: '2015-01-07'
  vtype: date
- name: Human Ancestry Ontology
  prefix: hancestro
  releases:
  - retrieved: '2021-02-02'
    version: '2.5'
  vtype: semver
- name: Human Cell Atlas Ontology
  prefix: hcao
  releases:
  - retrieved: '2021-02-02'
    version: '2020-12-03'
  - retrieved: '2021-02-27'
    version: '2021-02-18'
  - retrieved: '2021-03-29'
    version: '2021-03-18'
  - retrieved: '2021-04-21'
    version: '2021-04-19'
  - retrieved: '2021-04-24'
    version: '2021-04-22'
  - retrieved: '2021-05-20'
    version: '2021-05-18'
  - retrieved: '2021-06-25'
    version: '2021-06-16'
  - retrieved: '2021-07-27'
    version: '2021-07-19'
  - retrieved: '2021-07-28'
    version: '2021-06-16'
  - retrieved: '2021-07-30'
    version: '2021-07-19'
  - retrieved: '2021-09-08'
    version: '2021-08-18'
  - retrieved: '2021-09-09'
    version: '2021-07-19'
  - retrieved: '2021-09-15'
    version: '2021-08-18'
  - retrieved: '2021-09-19'
    version: '2021-09-16'
  - retrieved: '2021-10-29'
    version: '2021-10-19'
  - retrieved: '2021-11-19'
    version: '2021-11-16'
  - retrieved: '2022-01-04'
    version: '2021-12-16'
  - retrieved: '2022-01-23'
    version: '2022-01-18'
  - retrieved: '2022-03-03'
    version: '2022-02-16'
  - retrieved: '2022-03-26'
    version: '2022-03-16'
  - retrieved: '2022-05-10'
    version: '2022-04-19'
  vtype: date
- name: Human developmental anatomy, abstract
  prefix: ehdaa2
  releases:
  - retrieved: '2021-02-02'
    version: '2013-07-04'
  vtype: date
- name: Human Developmental Stages
  prefix: hsapdv
  releases:
  - retrieved: '2021-02-02'
    version: '2020-03-10'
  vtype: date
- name: Human Phenotype Ontology
  prefix: hp
  releases:
  - retrieved: '2020-12-23'
    version: '2020-12-07'
  - retrieved: '2021-02-12'
    version: '2021-02-08'
  - retrieved: '2021-03-03'
    version: '2021-02-28'
  - retrieved: '2021-04-16'
    version: '2021-04-13'
  - retrieved: '2021-06-14'
    version: '2021-06-08'
  - retrieved: '2021-06-25'
    version: '2021-06-13'
  - retrieved: '2021-09-08'
    version: '2021-08-02'
  - retrieved: '2021-09-09'
    version: '2021-06-13'
  - retrieved: '2021-09-15'
    version: '2021-08-02'
  - retrieved: '2021-10-15'
    version: '2021-10-10'
  - retrieved: '2022-03-03'
    version: '2022-02-14'
  - retrieved: '2022-04-27'
    version: '2022-04-14'
  vtype: date
- name: HUPO-PSI cross-linking and derivatization reagents controlled vocabulary
  prefix: xlmod
  releases:
  - retrieved: '2022-03-03'
    version: '2019-10-28'
  vtype: date
- name: Hymenoptera Anatomy Ontology
  prefix: hao
  releases:
  - retrieved: '2021-02-02'
    version: '2018-04-26'
  - retrieved: '2021-03-08'
    version: '2021-03-05'
  vtype: date
- name: Hypertension Ontology
  prefix: htn
  releases:
  - retrieved: '2021-04-14'
    version: 10-06-2019
  - retrieved: '2021-06-14'
    version: '2019-06-10'
  vtype: date
- name: Hypertension Ontology For Clinical Data
  prefix: htn
  releases:
  - retrieved: '2021-02-02'
    version: 10-06-2019
  vtype: date
- name: 'ICEO: Ontology of Integrative and Conjugative Elements'
  prefix: iceo
  releases:
  - retrieved: '2021-02-02'
    version: '2.0'
  - retrieved: '2021-02-04'
    version: '2.1'
  vtype: semver
- name: Infectious Disease Ontology
  prefix: ido
  releases:
  - retrieved: '2021-02-02'
    version: '2017-11-03'
  vtype: date
- name: Information Artifact Ontology
  prefix: iao
  releases:
  - retrieved: '2021-02-02'
    version: '2020-12-09'
  vtype: date
- name: Informed Consent Ontology
  prefix: ico
  releases:
  - retrieved: '2021-02-02'
    version: Arbor version; 1.0.100
  - retrieved: '2021-02-04'
    version: 1.0.100
  - retrieved: '2021-04-14'
    version: 1.0.187
  vtype: semver
- name: Informed Consent Ontology (ICO)
  prefix: ico
  releases:
  - retrieved: '2021-04-05'
    version: 1.0.187
  vtype: semver
- name: 'INO: Interaction Network Ontology'
  prefix: ino
  releases:
  - retrieved: '2021-02-02'
    version: 1.0.112
  vtype: semver
- name: IntAct
  prefix: intact
  releases:
  - homepage: ftp://ftp.ebi.ac.uk/pub/databases/intact/2020-12-16/
    retrieved: '2020-12-25'
    version: '2020-12-16'
  - date: '2021-03-10'
    homepage: ftp://ftp.ebi.ac.uk/pub/databases/intact/2021-03-10/
    retrieved: '2021-03-16'
    version: '2021-03-10'
  - date: '2021-05-05'
    homepage: ftp://ftp.ebi.ac.uk/pub/databases/intact/2021-05-05/
    retrieved: '2021-05-18'
    version: '2021-05-05'
  - date: '2021-07-06'
    homepage: ftp://ftp.ebi.ac.uk/pub/databases/intact/2021-07-06/
    retrieved: '2021-07-27'
    version: '2021-07-06'
  - date: '2021-10-13'
    homepage: ftp://ftp.ebi.ac.uk/pub/databases/intact/2021-10-13/
    retrieved: '2021-10-19'
    version: '2021-10-13'
  - date: '2022-02-03'
    homepage: ftp://ftp.ebi.ac.uk/pub/databases/intact/2022-02-03/
    retrieved: '2022-02-08'
    version: '2022-02-03'
  vtype: date
- name: Integrative and Conjugative Element Ontology
  prefix: iceo
  releases:
  - retrieved: '2021-04-14'
    version: '2.1'
  vtype: semver
- name: Interaction Network Ontology
  prefix: ino
  releases:
  - retrieved: '2021-04-14'
    version: 1.0.112
  vtype: semver
- name: InterPro
  prefix: interpro
  releases:
  - homepage: ftp://ftp.ebi.ac.uk/pub/databases/interpro/83.0/
    retrieved: '2020-12-25'
    version: '83.0'
  - date: '2021-02-11'
    homepage: ftp://ftp.ebi.ac.uk/pub/databases/interpro/84.0/
    retrieved: '2021-02-12'
    version: '84.0'
  - date: '2021-02-11'
    homepage: ftp://ftp.ebi.ac.uk/pub/databases/interpro/85.0/
    retrieved: '2021-04-11'
    version: '85.0'
  - date: '2021-04-08'
    homepage: ftp://ftp.ebi.ac.uk/pub/databases/interpro/86.0/
    retrieved: '2021-06-14'
    version: '86.0'
  - date: '2021-06-03'
    homepage: ftp://ftp.ebi.ac.uk/pub/databases/interpro/87.0/
    retrieved: '2021-11-02'
    version: '87.0'
  - date: '2021-11-18'
    homepage: ftp://ftp.ebi.ac.uk/pub/databases/interpro/88.0/
    retrieved: '2022-03-10'
    version: '88.0'
  vtype: semver_minor
- name: ITIS
  prefix: itis
  releases:
  - retrieved: '2021-11-15'
    version: 28-Oct-2021
  - retrieved: '2021-11-23'
    version: 27-Aug-2021
  - retrieved: '2021-12-03'
    version: 28-Oct-2021
  - retrieved: '2021-12-04'
    version: 02-Dec-2021
  - retrieved: '2021-12-23'
    version: 20-Dec-2021
  - retrieved: '2022-02-02'
    version: 31-Jan-2022
  - retrieved: '2022-03-03'
    version: 28-Feb-2022
  - retrieved: '2022-03-31'
    version: 28-Mar-2022
  - retrieved: '2022-05-03'
    version: 26-Apr-2022
  vtype: date
- name: KEGG
  prefix: kegg.pathway
  releases:
  - date: '2021-01-01'
    retrieved: '2021-01-02'
    version: '97.0'
  - date: '2021-04-01'
    retrieved: '2021-04-01'
    version: '98.0'
  - date: '2021-05-01'
    retrieved: '2021-05-01'
    version: '98.1'
  - date: '2021-06-01'
    retrieved: '2021-06-01'
    version: '98.2'
  - date: '2021-07-01'
    retrieved: '2021-07-01'
    version: '99.0'
  - date: '2021-08-01'
    retrieved: '2021-07-31'
    version: '99.1'
  - date: '2021-10-01'
    retrieved: '2021-10-01'
    version: '100.0'
  - date: '2022-01-01'
    retrieved: '2021-12-31'
    version: '101.0'
  - date: '2022-04-01'
    retrieved: '2022-04-01'
    version: '102.0'
  vtype: semver_minor
- name: Kinetic Simulation Algorithm Ontology
  prefix: biomodels.kisao
  releases:
  - retrieved: '2021-04-14'
    version: '2.14'
  - retrieved: '2021-10-15'
    version: '2.30'
  vtype: semver
- name: KiSAO
  prefix: biomodels.kisao
  releases:
  - retrieved: '2021-02-02'
    version: '2.14'
  vtype: semver
- name: Lentil ontology
  prefix: co_339
  releases:
  - retrieved: '2021-02-02'
    version: 09-10-2019
  - retrieved: '2021-06-14'
    version: '2019-10-09'
  vtype: date
- name: Lepidoptera Anatomy Ontology
  prefix: lepao
  releases:
  - retrieved: '2022-01-04'
    version: '2021-11-20'
  vtype: date
- name: Livestock Breed Ontology
  prefix: lbo
  releases:
  - retrieved: '2021-02-02'
    version: 26-03-2019
  - retrieved: '2021-06-14'
    version: '2019-03-26'
  vtype: date
- name: Maize ontology
  prefix: co_322
  releases:
  - retrieved: '2021-02-02'
    version: 09-10-2019
  - retrieved: '2021-06-14'
    version: '2019-10-09'
  vtype: date
- name: Malaria Ontology
  prefix: idomal
  releases:
  - retrieved: '2021-02-02'
    version: '2015-03-16'
  vtype: date
- name: Mammalian Feeding Muscle Ontology
  prefix: mfmo
  releases:
  - retrieved: '2021-02-02'
    version: '2013-11-16'
  vtype: date
- name: Mammalian Phenotype Ontology
  prefix: mp
  releases:
  - retrieved: '2021-02-02'
    version: 11-11-2019
  - retrieved: '2021-06-14'
    version: '2019-11-11'
  vtype: date
- name: Mass Spectrometry Controlled Vocabulary
  prefix: ms
  releases:
  - retrieved: '2021-02-02'
    version: 21-11-2019
  vtype: date
- name: Mass spectrometry ontology
  prefix: ms
  releases:
  - retrieved: '2021-04-14'
    version: 21-11-2019
  - retrieved: '2021-06-14'
    version: '2019-11-21'
  vtype: date
- name: Mathematical modeling ontology
  prefix: mamo
  releases:
  - retrieved: '2021-04-14'
    version: '2020-08-24'
  vtype: date
- name: Mathematical Modelling Ontology
  prefix: mamo
  releases:
  - retrieved: '2021-02-02'
    version: '2020-08-24'
  vtype: date
- name: Measurement method ontology
  prefix: mmo
  releases:
  - retrieved: '2021-02-02'
    version: 27-03-2019
  - retrieved: '2021-06-14'
    version: '2019-03-27'
  vtype: date
- name: Medaka Developmental Stages
  prefix: olatdv
  releases:
  - retrieved: '2021-02-02'
    version: '2020-03-10'
  vtype: date
- name: Medical Action Ontology
  prefix: maxo
  releases:
  - retrieved: '2021-02-02'
    version: '2020-12-10'
  - retrieved: '2021-02-12'
    version: '2021-02-09'
  - retrieved: '2021-02-26'
    version: '2021-02-22'
  - retrieved: '2021-02-27'
    version: '2021-02-25'
  - retrieved: '2021-03-29'
    version: '2021-03-22'
  - retrieved: '2021-07-27'
    version: '2021-06-11'
  - retrieved: '2021-09-08'
    version: '2021-08-16'
  - retrieved: '2021-09-09'
    version: '2021-06-11'
  - retrieved: '2021-09-15'
    version: '2021-08-19'
  - retrieved: '2022-03-28'
    version: '2022-03-23'
  - retrieved: '2022-04-27'
    version: '2022-04-11'
  vtype: date
- name: Mental Disease Ontology
  prefix: mfomd
  releases:
  - retrieved: '2021-02-02'
    version: '2020-04-26'
  vtype: date
- name: Mental Functioning Ontology
  prefix: mf
  releases:
  - retrieved: '2021-02-02'
    version: '2020-08-07'
  - retrieved: '2021-10-01'
    version: '2021-09-21'
  - retrieved: '2021-11-20'
    version: '2021-11-17'
  vtype: date
- name: MeSH
  prefix: mesh
  releases:
  - homepage: ftp://nlmpubs.nlm.nih.gov/online/mesh/2020
    retrieved: '2021-03-29'
    version: '2020'
  - homepage: ftp://nlmpubs.nlm.nih.gov/online/mesh/2021
    retrieved: '2021-09-08'
    version: '2021'
  - homepage: ftp://nlmpubs.nlm.nih.gov/online/mesh/2022
    retrieved: '2021-12-07'
    version: '2022'
  vtype: year
- name: Metabolomics Standards Initiative Ontology
  prefix: msio
  releases:
  - retrieved: '2021-04-14'
    version: 1.0.1
  vtype: semver
- name: Metabolomics Standards Initiative Ontology (MSIO)
  prefix: msio
  releases:
  - retrieved: '2021-02-02'
    version: 1.0.1
  vtype: semver
- name: MHC Restriction Ontology
  prefix: mro
  releases:
  - retrieved: '2021-02-02'
    version: '2021-01-25'
  - retrieved: '2021-03-05'
    version: '2021-03-03'
  - retrieved: '2021-03-08'
    version: '2021-03-05'
  - retrieved: '2021-03-11'
    version: '2021-03-09'
  - retrieved: '2021-03-29'
    version: '2021-03-23'
  - retrieved: '2021-04-18'
    version: '2021-04-15'
  - retrieved: '2021-05-01'
    version: '2021-04-29'
  - retrieved: '2021-05-06'
    version: '2021-05-04'
  - retrieved: '2021-07-27'
    version: '2021-07-09'
  - retrieved: '2021-07-30'
    version: '2021-07-23'
  - retrieved: '2021-09-08'
    version: '2021-07-28'
  - retrieved: '2021-09-09'
    version: '2021-07-23'
  - retrieved: '2021-09-15'
    version: '2021-07-28'
  - retrieved: '2021-10-01'
    version: '2021-09-24'
  - retrieved: '2021-10-29'
    version: '2021-10-15'
  - retrieved: '2021-11-11'
    version: '2021-11-04'
  - retrieved: '2021-12-04'
    version: '2021-11-29'
  - retrieved: '2022-01-04'
    version: '2021-12-15'
  - retrieved: '2022-01-19'
    version: '2022-01-13'
  - retrieved: '2022-01-23'
    version: '2022-01-17'
  - retrieved: '2022-03-26'
    version: '2022-03-14'
  vtype: date
- name: MIAPA Ontology
  prefix: miapa
  releases:
  - retrieved: '2021-04-14'
    version: 09-05-2017
  - retrieved: '2021-06-14'
    version: '2017-05-09'
  vtype: date
- name: Microbial Conditions Ontology
  prefix: mco
  releases:
  - retrieved: '2021-02-02'
    version: '2019-05-15'
  vtype: date
- name: Minimum Anformation About a Phylogenetic Analysis Ontology
  prefix: miapa
  releases:
  - retrieved: '2022-01-11'
    version: '2017-05-09'
  vtype: date
- name: Minimum Information for A Phylogenetic Analysis (MIAPA) Ontology
  prefix: miapa
  releases:
  - retrieved: '2021-02-02'
    version: 09-05-2017
  vtype: date
- name: Minimum PDDI Information Ontology
  prefix: mpio
  releases:
  - retrieved: '2021-02-02'
    version: release version 2019-01-30
  - retrieved: '2021-02-04'
    version: '2019-01-30'
  vtype: date
- name: miRBase
  prefix: mirbase
  releases:
  - homepage: ftp://mirbase.org/pub/mirbase/22.1/
    retrieved: '2020-12-22'
    version: '22.1'
  vtype: semver_minor
- name: Molecular Interactions Controlled Vocabulary
  prefix: mi
  releases:
  - retrieved: '2021-04-14'
    version: '2020-04-13'
  vtype: date
- name: Molecular Interactions Ontology
  prefix: mi
  releases:
  - retrieved: '2021-02-02'
    version: '2020-04-13'
  vtype: date
- name: Molecular Oncology Almanac
  releases:
  - date: '2021-09-02'
    homepage: https://github.com/vanallenlab/moalmanac-db/releases/tag/v.2021-09-02
    retrieved: '2021-10-04'
    version: '2021-09-02'
  - date: '2021-10-07'
    homepage: https://github.com/vanallenlab/moalmanac-db/releases/tag/v.2021-10-07
    retrieved: '2021-10-09'
    version: '2021-10-07'
  - date: '2021-11-04'
    homepage: https://github.com/vanallenlab/moalmanac-db/releases/tag/v.2021-11-04
    retrieved: '2021-11-15'
    version: '2021-11-04'
  vtype: date
- name: Molecular Process Ontology
  prefix: mop
  releases:
  - retrieved: '2021-04-14'
    version: '2014-09-03'
  - retrieved: '2022-03-03'
    version: '2022-02-01'
  vtype: date
- name: Monarch Disease Ontology
  prefix: mondo
  releases:
  - retrieved: '2021-04-14'
    version: '2021-04-07'
  - retrieved: '2021-05-04'
    version: '2021-04-30'
  - retrieved: '2021-06-03'
    version: '2021-06-01'
  - retrieved: '2021-07-27'
    version: '2021-07-12'
  - retrieved: '2021-07-28'
    version: '2021-06-01'
  - retrieved: '2021-07-30'
    version: '2021-07-12'
  - retrieved: '2021-09-08'
    version: '2021-08-11'
  - retrieved: '2021-09-09'
    version: '2021-07-12'
  - retrieved: '2021-09-15'
    version: '2021-09-01'
  - retrieved: '2021-11-11'
    version: '2021-11-01'
  - retrieved: '2021-12-04'
    version: '2021-12-01'
  - retrieved: '2022-01-11'
    version: '2021-12-30'
  - retrieved: '2022-03-03'
    version: '2022-02-04'
  - retrieved: '2022-03-04'
    version: '2022-03-01'
  - retrieved: '2022-04-12'
    version: '2022-04-04'
  - retrieved: '2022-05-10'
    version: '2022-05-02'
  vtype: date
- name: Mondo Disease Ontology
  prefix: mondo
  releases:
  - retrieved: '2021-02-02'
    version: '2021-01-29'
  - retrieved: '2021-03-05'
    version: '2021-03-03'
  - retrieved: '2021-04-09'
    version: '2021-04-07'
  vtype: date
- name: MOP
  prefix: mop
  releases:
  - retrieved: '2021-02-02'
    version: '2014-09-03'
  vtype: date
- name: Mosquito gross anatomy ontology
  prefix: tgma
  releases:
  - retrieved: '2021-02-02'
    version: '2013-06-03'
  vtype: date
- name: Mosquito insecticide resistance
  prefix: miro
  releases:
  - retrieved: '2021-02-02'
    version: '2014-05-14'
  vtype: date
- name: Mouse Adult Gross Anatomy
  prefix: ma
  releases:
  - retrieved: '2021-02-02'
    version: '2017-02-07'
  vtype: date
- name: Mouse adult gross anatomy
  prefix: ma
  releases:
  - retrieved: '2021-04-14'
    version: '2017-02-07'
  vtype: date
- name: Mouse Developmental Anatomy Ontology
  prefix: emapa
  releases:
  - retrieved: '2021-02-02'
    version: '2020-02-12'
  - retrieved: '2021-09-15'
    version: '2021-09-01'
  vtype: date
- name: Mouse Developmental Stages
  prefix: mmusdv
  releases:
  - retrieved: '2021-02-02'
    version: '2020-03-10'
  vtype: date
- name: Mouse pathology ontology
  prefix: mpath
  releases:
  - retrieved: '2021-02-02'
    version: '2020-05-19'
  vtype: date
- name: MSigDB
  prefix: msigdb
  releases:
  - date: September 2020
    retrieved: '2020-12-22'
    version: '7.2'
  - date: '2021-03-01'
    homepage: https://data.broadinstitute.org/gsea-msigdb/msigdb/release/7.3
    retrieved: '2021-03-23'
    version: '7.3'
  - date: '2021-04-01'
    homepage: https://data.broadinstitute.org/gsea-msigdb/msigdb/release/7.4
    retrieved: '2021-04-05'
    version: '7.4'
  - date: '2022-01-01'
    homepage: https://data.broadinstitute.org/gsea-msigdb/msigdb/release/7.5
    retrieved: '2022-01-14'
    version: '7.5'
  - date: '2022-01-01'
    homepage: https://data.broadinstitute.org/gsea-msigdb/msigdb/release/7.5.1
    retrieved: '2022-01-21'
    version: 7.5.1
  vtype: month
- name: Mungbean ontology
  prefix: co_346
  releases:
  - retrieved: '2021-02-02'
    version: 09-10-2019
  - retrieved: '2021-06-14'
    version: '2019-10-09'
  vtype: date
- name: Name Reaction Ontology
  prefix: rxno
  releases:
  - retrieved: '2021-04-14'
    version: '2021-01-21'
  - retrieved: '2021-12-09'
    version: '2021-12-06'
  - retrieved: '2022-01-04'
    version: '2021-12-16'
  vtype: date
- name: National Cancer Institute Thesaurus
  prefix: ncit
  releases:
  - date: '2021-08-30'
    retrieved: '2021-09-23'
    version: 21.08e
  - date: '2021-09-27'
    retrieved: '2021-10-05'
    version: 21.09d
  - date: '2021-10-25'
    retrieved: '2021-10-31'
    version: 21.10d
  - date: '2021-11-30'
    retrieved: '2021-12-11'
    version: 21.11e
  - date: '2021-12-27'
    retrieved: '2022-01-08'
    version: 21.12d
  - date: '2022-01-31'
    retrieved: '2022-02-10'
    version: 22.01e
  - date: '2022-02-28'
    retrieved: '2022-03-08'
    version: 22.02d
  - date: '2022-03-28'
    retrieved: '2022-04-07'
    version: 22.03d
  - date: '2022-04-25'
    retrieved: '2022-04-30'
    version: 22.04d
  vtype: other
- name: NCBI Gene
  prefix: ncbigene
  releases:
  - retrieved: '2021-01-03'
    version: daily
  vtype: daily
- name: NCBI organismal classification
  prefix: ncbitaxon
  releases:
  - retrieved: '2021-04-14'
    version: '2021-02-15'
  - retrieved: '2021-06-25'
    version: '2021-06-10'
  - retrieved: '2021-12-16'
    version: '2021-12-13'
  - retrieved: '2021-12-17'
    version: '2021-12-14'
  vtype: date
- name: NCBI Taxonomy
  prefix: ncbitaxon
  releases:
  - retrieved: '2022-05-14'
    version: '2021-12-14'
  vtype: date
- name: NCI Thesaurus
  prefix: ncit
  releases:
  - retrieved: '2021-02-02'
    version: 20.06e
  - retrieved: '2021-02-17'
    version: 21.01d
  - retrieved: '2021-05-26'
    version: 21.03e
  - retrieved: '2021-05-28'
    version: 21.05d
  vtype: other
- name: Neuro Behavior Ontology
  prefix: nbo
  releases:
  - retrieved: '2021-02-02'
    version: '2020-02-10'
  - retrieved: '2021-02-25'
    version: '2021-02-15'
  vtype: date
- name: NMR-instrument specific component of metabolomics investigations
  prefix: nmr
  releases:
  - retrieved: '2021-04-14'
    version: 1.1.0
  vtype: semver
- name: NOMEN - A nomenclatural ontology for biological names
  prefix: nomen
  releases:
  - retrieved: '2021-02-02'
    version: 17-04-2019
  - retrieved: '2021-06-14'
    version: '2019-04-17'
  vtype: date
- name: Non-Coding RNA Ontology
  prefix: ncro
  releases:
  - retrieved: '2021-02-02'
    version: '2015-12-10'
  vtype: date
- name: NPASS
  prefix: npass
  releases:
  - retrieved: '2021-01-03'
    version: '1.0'
  vtype: semver_minor
- name: Nuclear Magnetic Resonance Controlled Vocabulary
  prefix: nmr
  releases:
  - retrieved: '2021-02-02'
    version: 1.1.0
  vtype: semver
- name: 'OAE: Ontology of Adverse Events'
  prefix: oae
  releases:
  - retrieved: '2021-02-02'
    version: 1.2.36
  - retrieved: '2021-02-12'
    version: 1.2.37
  - retrieved: '2021-03-09'
    version: 1.2.38
  vtype: semver
- name: Oat ontology
  prefix: co_350
  releases:
  - retrieved: '2021-02-02'
    version: 09-10-2019
  - retrieved: '2021-06-14'
    version: '2019-10-09'
  vtype: date
- name: OBO Metadata Ontology
  prefix: omo
  releases:
  - retrieved: '2021-02-02'
    version: '2020-06-08'
  - retrieved: '2022-05-10'
    version: '2022-04-27'
  vtype: date
- name: Obstetric and Neonatal Ontology
  prefix: ontoneo
  releases:
  - retrieved: '2021-02-02'
    version: '2017-03-04'
  - retrieved: '2021-11-03'
    version: v1.6
  vtype: date
- name: 'OGG: Ontology of Genes and Genomes'
  prefix: ogg
  releases:
  - retrieved: '2021-02-02'
    version: 'Vision Release: 1.0.59'
  - retrieved: '2021-02-04'
    version: 1.0.59
  vtype: semver
- name: 'OHMI: Ontology of Host-Microbiome Interactions'
  prefix: ohmi
  releases:
  - retrieved: '2021-02-02'
    version: '2019-09-17'
  vtype: date
- name: 'OHPI: Ontology of Host-Pathogen Interactions'
  prefix: ohpi
  releases:
  - retrieved: '2021-02-02'
    version: 02-10-2019
  vtype: date
- name: OMIT
  prefix: omit
  releases:
  - retrieved: '2021-02-02'
    version: 07-06-2019
  vtype: date
- name: OncoTree
  prefix: oncotree
  releases:
  - date: '2020-10-01'
    homepage: http://oncotree.mskcc.org/api/tumorTypes?version=oncotree_2020_10_01
    retrieved: '2021-10-04'
    version: '2020-10-01'
  - date: '2021-11-02'
    homepage: http://oncotree.mskcc.org/api/tumorTypes?version=oncotree_2021_11_02
    retrieved: '2021-11-03'
    version: '2021-11-02'
  vtype: date
- name: 'OntoAvida: ontology for Avida digital evolution platform'
  prefix: ontoavida
  releases:
  - retrieved: '2022-01-04'
    version: '2021-09-01'
  vtype: date
- name: Ontologized MIABIS
  prefix: omiabis
  releases:
  - retrieved: '2021-02-02'
    version: ' 2014-05-28'
  - retrieved: '2021-02-04'
    version: '2014-05-28'
  vtype: date
- name: Ontology for Avida digital evolution platform
  prefix: ontoavida
  releases:
  - retrieved: '2022-01-11'
    version: '2021-12-20'
  - retrieved: '2022-03-26'
    version: '2022-03-15'
  vtype: date
- name: Ontology for Biobanking
  prefix: obib
  releases:
  - retrieved: '2021-04-14'
    version: '2021-02-02'
  - retrieved: '2021-11-27'
    version: '2021-11-12'
  vtype: date
- name: Ontology for BIoBanking (OBIB)
  prefix: obib
  releases:
  - retrieved: '2021-02-02'
    version: '2019-06-20'
  - retrieved: '2021-02-12'
    version: '2021-02-02'
  vtype: date
- name: Ontology for Biomedical Investigations
  prefix: obi
  releases:
  - retrieved: '2021-02-02'
    version: '2020-12-16'
  - retrieved: '2021-04-21'
    version: '2021-04-06'
  - retrieved: '2021-10-01'
    version: '2021-08-18'
  - retrieved: '2022-01-13'
    version: '2022-01-03'
  vtype: date
- name: Ontology for General Medical Science
  prefix: ogms
  releases:
  - retrieved: '2021-02-02'
    version: '2020-07-06'
  - retrieved: '2021-04-23'
    version: '2021-04-20'
  - retrieved: '2021-11-03'
    version: '2021-08-19'
  vtype: date
- name: Ontology for genetic interval
  prefix: ogi
  releases:
  - retrieved: '2021-02-02'
    version: '2.0'
  vtype: semver
- name: Ontology for MicroRNA Target
  prefix: omit
  releases:
  - retrieved: '2021-04-14'
    version: 07-06-2019
  - retrieved: '2021-06-14'
    version: '2019-06-07'
  vtype: date
- name: Ontology for Nutritional Studies
  prefix: ons
  releases:
  - retrieved: '2021-02-02'
    version: Relese version 1.0
  - retrieved: '2021-02-04'
    version: '1.0'
  - retrieved: '2021-06-14'
    version: 1.2.0
  - retrieved: '2021-07-06'
    version: June 2021 release
  vtype: date
- name: Ontology for Parasite Lifecycle
  prefix: opl
  releases:
  - retrieved: '2021-02-02'
    version: '2021-01-28'
  vtype: date
- name: Ontology for Parasite LifeCycle
  prefix: opl
  releases:
  - retrieved: '2021-04-14'
    version: '2021-01-28'
  vtype: date
- name: Ontology for RNA sequencing (ORNASEQ)
  prefix: ornaseq
  releases:
  - retrieved: '2021-02-02'
    version: '2019-07-08'
  vtype: date
- name: Ontology for the Anatomy of the Insect SkeletoMuscular system
  prefix: aism
  releases:
  - retrieved: '2021-05-28'
    version: '2021-05-21'
  - retrieved: '2021-07-27'
    version: '2021-07-03'
  - retrieved: '2021-09-08'
    version: '2021-08-10'
  - retrieved: '2021-09-09'
    version: '2021-07-03'
  - retrieved: '2021-09-15'
    version: '2021-09-08'
  - retrieved: '2021-11-27'
    version: '2021-11-19'
  - retrieved: '2021-12-16'
    version: '2021-12-13'
  - retrieved: '2022-03-26'
    version: '2022-03-17'
  vtype: date
- name: Ontology of Adverse Events
  prefix: oae
  releases:
  - retrieved: '2021-04-14'
    version: 1.2.38
  - retrieved: '2021-09-15'
    version: 1.2.44
  vtype: semver
- name: Ontology of Arthropod Circulatory Systems
  prefix: oarcs
  releases:
  - retrieved: '2021-02-02'
    version: '2019-04-18'
  vtype: date
- name: Ontology of Biological and Clinical Statistics
  prefix: obcs
  releases:
  - retrieved: '2021-02-02'
    version: '101'
  vtype: sequential
- name: Ontology of Biological Attributes
  prefix: oba
  releases:
  - retrieved: '2021-02-02'
    version: 22-05-2019
  - retrieved: '2021-06-14'
    version: '2019-05-22'
  - retrieved: '2021-12-08'
    version: '2021-12-03'
  vtype: date
- name: Ontology of Genetic Susceptibility Factor
  prefix: ogsf
  releases:
  - retrieved: '2021-02-02'
    version: '2.0'
  vtype: semver
- name: Ontology of Host Pathogen Interactions
  prefix: ohpi
  releases:
  - retrieved: '2021-04-14'
    version: 02-10-2019
  - retrieved: '2021-06-14'
    version: '2019-10-02'
  vtype: date
- name: Ontology of Host-Microbiome Interactions
  prefix: ohmi
  releases:
  - retrieved: '2021-04-14'
    version: '2019-09-17'
  vtype: date
- name: Ontology of Medically Related Social Entities
  prefix: omrse
  releases:
  - retrieved: '2021-02-02'
    version: '2020-10-27'
  - retrieved: '2021-11-03'
    version: '2021-08-30'
  - retrieved: '2022-04-27'
    version: '2022-04-06'
  vtype: date
- name: Ontology of Microbial Phenotypes
  prefix: omp
  releases:
  - retrieved: '2021-02-02'
    version: '2021-01-08'
  - retrieved: '2021-02-12'
    version: '2021-02-05'
  - retrieved: '2021-03-08'
    version: '2021-03-05'
  - retrieved: '2021-04-21'
    version: '2021-04-16'
  - retrieved: '2021-05-12'
    version: '2021-05-07'
  - retrieved: '2021-06-14'
    version: '2021-06-04'
  - retrieved: '2021-07-27'
    version: '2021-07-02'
  - retrieved: '2021-09-08'
    version: '2021-08-11'
  - retrieved: '2021-09-09'
    version: '2021-07-02'
  - retrieved: '2021-09-15'
    version: '2021-08-11'
  - retrieved: '2021-09-19'
    version: '2021-09-13'
  - retrieved: '2021-12-08'
    version: '2021-12-03'
  - retrieved: '2022-01-13'
    version: '2022-01-07'
  - retrieved: '2022-03-03'
    version: '2022-02-08'
  - retrieved: '2022-03-26'
    version: '2022-03-04'
  - retrieved: '2022-04-27'
    version: '2022-04-11'
  vtype: date
- name: Ontology of Organizational Structures of Trauma centers and Trauma Systems
  prefix: oostt
  releases:
  - retrieved: '2021-02-02'
    version: release version - 2021-01-11
  - retrieved: '2021-02-04'
    version: '2021-01-11'
  vtype: date
- name: Ontology of Organizational Structures of Trauma centers and Trauma systems
  prefix: oostt
  releases:
  - retrieved: '2021-04-14'
    version: '2021-01-11'
  vtype: date
- name: Ontology of Precision Medicine and Investigation
  prefix: opmi
  releases:
  - retrieved: '2021-04-14'
    version: 1.0.118
  - retrieved: '2021-05-08'
    version: 1.0.125
  - retrieved: '2021-05-14'
    version: 1.0.128
  - retrieved: '2021-06-01'
    version: 1.0.130
  - retrieved: '2022-01-23'
    version: 1.0.138
  - retrieved: '2022-03-03'
    version: 1.0.146
  - retrieved: '2022-03-26'
    version: 1.0.152
  vtype: semver
- name: Ontology of Prokaryotic Phenotypic and Metabolic Characters
  prefix: micro
  releases:
  - retrieved: '2021-02-02'
    version: 'MicrO (An Ontology of Prokaryotic Phenotypic and Metabolic Characters).  Version
      1.5.1 released 6/14/2018.


      Includes terms and term synonyms extracted from > 3000 prokaryotic taxonomic
      descriptions, collected from a large number of taxonomic descriptions from Archaea,
      Cyanobacteria, Bacteroidetes, Firmicutes and Mollicutes.


      The ontology and the synonym lists were developed to facilitate the automated
      extraction of phenotypic data and character states from prokaryotic taxonomic
      descriptions using a natural language processing algorithm (MicroPIE).  MicroPIE
      was developed by Hong Cui, Elvis Hsin-Hui Wu, and Jin Mao (University of Arizona)
      in collaboration with Carrine E. Blank (University of Montana) and Lisa R. Moore
      (University of Southern Maine).


      Descriptions and links to MicroPIE can be found at http://avatol.org/ngp/nlp/overview-2/.

      https://github.com/biosemantics/micropie2


      The most current version of MicrO can be downloaded from https://github.com/carrineblank/MicrO.'
  - retrieved: '2021-02-04'
    version: 1.5.1
  vtype: semver
- name: Ontology of RNA Sequencing
  prefix: ornaseq
  releases:
  - retrieved: '2021-04-14'
    version: '2019-07-08'
  vtype: date
- name: Ontology of units of Measure
  prefix: om
  releases:
  - retrieved: '2021-04-14'
    version: 2.0.30
  - retrieved: '2021-06-05'
    version: 2.0.31
  - retrieved: '2021-10-31'
    version: 2.0.34
  - retrieved: '2022-01-04'
    version: 2.0.35
  vtype: semver
- name: Ontology of units of Measure (OM)
  prefix: om
  releases:
  - retrieved: '2021-02-02'
    version: 2.0.28
  - retrieved: '2021-02-16'
    version: 2.0.29
  - retrieved: '2021-03-16'
    version: 2.0.30
  vtype: semver
- name: Ontology of Vaccine Adverse Events
  prefix: ovae
  releases:
  - retrieved: '2021-04-14'
    version: 1.0.34
  vtype: semver
- name: 'OPMI: Ontology of Precision Medicine and Investigation'
  prefix: opmi
  releases:
  - retrieved: '2021-02-02'
    version: 'Vision Release: 1.0.118'
  - retrieved: '2021-02-04'
    version: 1.0.118
  vtype: semver
- name: Oral Health and Disease Ontology
  prefix: ohd
  releases:
  - retrieved: '2022-03-03'
    version: '2016-06-27'
  vtype: date
- name: Orphanet Rare Disease Ontology
  prefix: orphanet.ordo
  releases:
  - retrieved: '2021-02-02'
    version: '3.1'
  - retrieved: '2021-07-27'
    version: '3.2'
  - retrieved: '2021-12-16'
    version: '3.3'
  - retrieved: '2021-12-18'
    version: '4.0'
  vtype: semver
- name: Orthology Ontology
  prefix: orth
  releases:
  - retrieved: '2021-03-29'
    version: 'This ontology is the second version of the orthology ontology first
      published in 2015 and available at http://purl.bioontology.org/ontology/ORTH
      .

      @authors T.M. de Farias, H. Chiba, J.T. Fernandez-Breis, E. Antezana, D. Kuznetsov,
      C. Dessimoz and F. Villiers.'
  vtype: garbage
- name: 'OVAE: Ontology of Vaccine Adverse Events'
  prefix: ovae
  releases:
  - retrieved: '2021-02-02'
    version: 'Vision Release: 1.0.34'
  - retrieved: '2021-02-04'
    version: 1.0.34
  vtype: semver
- name: PathBank
  prefix: pathbank
  releases:
  - retrieved: '2021-01-02'
    version: '2.0'
  vtype: semver_minor
- name: Pathogen Host Interaction Phenotype Ontology
  prefix: phipo
  releases:
  - retrieved: '2021-04-14'
    version: '2021-03-11'
  - retrieved: '2021-05-15'
    version: '2021-05-13'
  - retrieved: '2021-07-27'
    version: '2021-07-14'
  - retrieved: '2021-07-28'
    version: '2021-05-13'
  - retrieved: '2021-07-30'
    version: '2021-07-14'
  vtype: date
- name: Pathogen Host Interactions Phenotype Ontology
  prefix: phipo
  releases:
  - retrieved: '2021-02-02'
    version: '2021-01-28'
  - retrieved: '2021-02-27'
    version: '2021-02-25'
  - retrieved: '2021-03-13'
    version: '2021-03-11'
  vtype: date
- name: Pathogen Transmission Ontology
  prefix: trans
  releases:
  - retrieved: '2021-02-02'
    version: '2020-08-04'
  vtype: date
- name: Pathway Commons
  releases:
  - retrieved: '2021-11-18'
    version: '12'
  vtype: sequential
- name: Pathway Ontology
  prefix: pw
  releases:
  - retrieved: '2021-02-02'
    version: 23-10-2019
  vtype: date
- name: Pathway ontology
  prefix: pw
  releases:
  - retrieved: '2021-04-14'
    version: 23-10-2019
  - retrieved: '2021-06-14'
    version: '2019-10-23'
  vtype: date
- name: PATO
  prefix: pato
  releases:
  - retrieved: '2021-02-02'
    version: '2020-08-02'
  vtype: date
- name: Pearl millet ontology
  prefix: co_327
  releases:
  - retrieved: '2021-02-02'
    version: 09-10-2019
  - retrieved: '2021-06-14'
    version: '2019-10-09'
  vtype: date
- name: Performance Summary Display Ontology
  prefix: psdo
  releases:
  - retrieved: '2021-02-02'
    version: 1.0.0
  vtype: semver
- name: Pfam
  prefix: pfam
  releases:
  - homepage: ftp://ftp.ebi.ac.uk/pub/databases/Pfam/releases/Pfam34.0/
    retrieved: '2020-12-25'
    version: '34.0'
  - homepage: ftp://ftp.ebi.ac.uk/pub/databases/Pfam/releases/Pfam35.0/
    retrieved: '2021-11-11'
    version: '35.0'
  vtype: semver_minor
- name: Phenotype And Trait Ontology
  prefix: pato
  releases:
  - retrieved: '2020-12-22'
    version: '2020-08-02'
  - retrieved: '2021-04-16'
    version: '2021-04-14'
  - retrieved: '2021-04-21'
    version: '2021-04-16'
  - retrieved: '2021-05-28'
    version: '2021-05-26'
  - retrieved: '2021-06-25'
    version: '2021-06-15'
  - retrieved: '2021-07-27'
    version: '2021-07-09'
  - retrieved: '2021-09-08'
    version: '2021-08-06'
  - retrieved: '2021-09-09'
    version: '2021-07-09'
  - retrieved: '2021-09-15'
    version: '2021-08-06'
  - retrieved: '2021-09-19'
    version: '2021-09-09'
  - retrieved: '2021-11-11'
    version: '2021-11-05'
  - retrieved: '2021-12-08'
    version: '2021-12-03'
  - retrieved: '2022-01-15'
    version: '2022-01-12'
  - retrieved: '2022-03-03'
    version: '2022-02-20'
  vtype: date
- name: PHI-base Ontology
  prefix: phi
  releases:
  - retrieved: '2021-02-02'
    version: 10-12-2018
  - retrieved: '2021-06-14'
    version: '2018-12-10'
  vtype: date
- name: Physico-chemical methods and properties
  prefix: fix
  releases:
  - retrieved: '2021-02-02'
    version: '2020-04-13'
  vtype: date
- name: Physico-chemical process
  prefix: rex
  releases:
  - retrieved: '2021-02-02'
    version: '2017-11-19'
  vtype: date
- name: Pigeonpea ontology
  prefix: co_341
  releases:
  - retrieved: '2021-02-02'
    version: 18-11-2019
  - retrieved: '2021-06-14'
    version: '2019-11-18'
  vtype: date
- name: planaria-ontology
  prefix: plana
  releases:
  - retrieved: '2021-02-02'
    version: '2020-12-09'
  - retrieved: '2021-04-09'
    version: '2021-04-05'
  - retrieved: '2021-10-04'
    version: '2021-09-29'
  - retrieved: '2021-10-04'
    version: '2021-04-05'
  - retrieved: '2021-10-09'
    version: '2021-09-29'
  - retrieved: '2021-10-29'
    version: '2021-10-21'
  - retrieved: '2022-03-04'
    version: '2022-03-02'
  vtype: date
- name: Planarian Anatomy and Schmidtea mediterranean Developmental Stage Ontology
  prefix: plana
  releases:
  - retrieved: '2022-04-04'
    version: '2022-03-02'
  vtype: date
- name: Planarian Phenotype Ontology
  prefix: planp
  releases:
  - retrieved: '2021-04-14'
    version: '2020-03-28'
  vtype: date
- name: Planarian Phenotype Ontology (PLANP)
  prefix: planp
  releases:
  - retrieved: '2021-02-02'
    version: '2020-03-28'
  vtype: date
- name: Plant Environment Ontology
  prefix: peco
  releases:
  - retrieved: '2021-02-02'
    version: '2020-08-21'
  vtype: date
- name: Plant Experimental Conditions Ontology
  prefix: peco
  releases:
  - retrieved: '2021-04-14'
    version: '2020-08-21'
  vtype: date
- name: Plant Ontology
  prefix: po
  releases:
  - retrieved: '2020-12-22'
    version: '2020-08-20'
  - retrieved: '2021-09-08'
    version: '2021-08-13'
  - retrieved: '2021-09-09'
    version: '2020-08-20'
  - retrieved: '2021-09-15'
    version: '2021-08-13'
  vtype: date
- name: Plant Phenology Ontology
  prefix: ppo
  releases:
  - retrieved: '2021-02-02'
    version: '2018-10-26'
  vtype: date
- name: Plant Stress Ontology
  prefix: pso
  releases:
  - retrieved: '2021-02-02'
    version: '2020-05-19'
  vtype: date
- name: Plant Trait Ontology
  prefix: to
  releases:
  - retrieved: '2021-02-02'
    version: '2020-10-13'
  - retrieved: '2021-04-08'
    version: '2021-04-06'
  - retrieved: '2022-03-28'
    version: '2022-03-09'
  - retrieved: '2022-04-27'
    version: '2022-04-13'
  vtype: date
- name: Platynereis Developmental Stages
  prefix: pdumdv
  releases:
  - retrieved: '2021-02-02'
    version: '2020-03-10'
  vtype: date
- name: PomBase
  prefix: pombase
  releases:
  - date: '2021-09-01'
    homepage: https://www.pombase.org/data/releases/pombase-2021-09-01/
    retrieved: '2021-09-16'
    version: '2021-09-01'
  - date: '2021-10-05'
    homepage: https://www.pombase.org/data/releases/pombase-2021-10-05/
    retrieved: '2021-10-20'
    version: '2021-10-05'
  - date: '2021-11-03'
    homepage: https://www.pombase.org/data/releases/pombase-2021-11-03/
    retrieved: '2021-11-09'
    version: '2021-11-03'
  - date: '2022-01-02'
    homepage: https://www.pombase.org/data/releases/pombase-2022-01-02/
    retrieved: '2022-01-06'
    version: '2022-01-02'
  - date: '2022-02-01'
    homepage: https://www.pombase.org/data/releases/pombase-2022-02-01/
    retrieved: '2022-02-05'
    version: '2022-02-01'
  - date: '2022-03-01'
    homepage: https://www.pombase.org/data/releases/pombase-2022-03-01/
    retrieved: '2022-03-03'
    version: '2022-03-01'
  - date: '2022-04-01'
    homepage: https://www.pombase.org/data/releases/pombase-2022-04-01/
    retrieved: '2022-04-06'
    version: '2022-04-01'
  vtype: date
- name: Population and Community Ontology
  prefix: pco
  releases:
  - retrieved: '2021-02-02'
    version: '2020-08-26'
  - retrieved: '2021-05-05'
    version: '2021-05-03'
  vtype: date
- name: Porifera (sponge) ontology
  prefix: poro
  releases:
  - retrieved: '2021-02-02'
    version: '2016-09-13'
  vtype: date
- name: Porifera Ontology
  prefix: poro
  releases:
  - retrieved: '2021-04-14'
    version: '2016-09-13'
  - retrieved: '2021-11-11'
    version: '2016-10-06'
  vtype: date
- name: Potato ontology
  prefix: co_330
  releases:
  - retrieved: '2021-02-02'
    version: 09-10-2019
  - retrieved: '2021-06-14'
    version: '2019-10-09'
  vtype: date
- name: PRIDE
  prefix: pride
  releases:
  - retrieved: '2021-02-02'
    version: 05-11-2019
  vtype: date
- name: Probability Distribution Ontology
  prefix: probonto
  releases:
  - retrieved: '2021-04-14'
    version: 2.5.0
  vtype: semver
- name: ProbOnto
  prefix: probonto
  releases:
  - retrieved: '2021-02-02'
    version: 2.5.0
  vtype: semver
- name: Protein modification
  prefix: mod
  releases:
  - retrieved: '2021-04-14'
    version: '2020-04-14'
  vtype: date
- name: Protein Modification Ontology
  prefix: mod
  releases:
  - retrieved: '2021-02-02'
    version: '2020-04-14'
  vtype: date
- name: Protein Ontology
  prefix: pr
  releases:
  - retrieved: '2020-12-11'
    version: '61.0'
  - retrieved: '2020-12-22'
    version: '62.0'
  - homepage: https://proconsortium.org/download/release_63.0/
    retrieved: '2021-05-14'
    version: '63.0'
  - homepage: https://proconsortium.org/download/release_64.0/
    retrieved: '2021-12-15'
    version: '64.0'
  - homepage: https://proconsortium.org/download/release_65.0/
    retrieved: '2021-12-18'
    version: '65.0'
  - homepage: https://proconsortium.org/download/release_66.0/
    retrieved: '2022-04-02'
    version: '66.0'
  vtype: semver_minor
- name: PROV Namespace
  prefix: prov
  releases:
  - retrieved: '2021-03-21'
    version: '2013-04-30'
  vtype: date
- name: Provisional Cell Ontology
  prefix: pcl
  releases:
  - retrieved: '2022-03-03'
    version: '2022-02-09'
  - retrieved: '2022-03-04'
    version: '2022-03-02'
  - retrieved: '2022-05-10'
    version: '2022-04-27'
  vtype: date
- name: PubChem
  releases:
  - homepage: https://ftp.ncbi.nlm.nih.gov/pubchem/Compound/Monthly/2021-11-01
    retrieved: '2021-11-15'
    version: '2021-11-01'
  - homepage: https://ftp.ncbi.nlm.nih.gov/pubchem/Compound/Monthly/2021-12-01
    retrieved: '2021-12-01'
    version: '2021-12-01'
  - homepage: https://ftp.ncbi.nlm.nih.gov/pubchem/Compound/Monthly/2022-01-01
    retrieved: '2022-01-01'
    version: '2022-01-01'
  - homepage: https://ftp.ncbi.nlm.nih.gov/pubchem/Compound/Monthly/2022-02-01
    retrieved: '2022-02-01'
    version: '2022-02-01'
  - homepage: https://ftp.ncbi.nlm.nih.gov/pubchem/Compound/Monthly/2022-03-01
    retrieved: '2022-03-03'
    version: '2022-03-01'
  - homepage: https://ftp.ncbi.nlm.nih.gov/pubchem/Compound/Monthly/2022-04-01
    retrieved: '2022-04-01'
    version: '2022-04-01'
  - homepage: https://ftp.ncbi.nlm.nih.gov/pubchem/Compound/Monthly/2022-05-01
    retrieved: '2022-05-01'
    version: '2022-05-01'
  vtype: date
- name: Radiation Biology Ontology
  prefix: rbo
  releases:
  - retrieved: '2021-02-02'
    version: '2021-01-20'
  - retrieved: '2021-04-27'
    version: '2021-02-26'
  - retrieved: '2021-05-25'
    version: '2021-05-21'
  - retrieved: '2021-09-15'
    version: '2021-08-30'
  - retrieved: '2022-01-23'
    version: '2022-01-14'
  - retrieved: '2022-04-27'
    version: '2022-04-16'
  vtype: date
- name: Rat Strain Ontology
  prefix: rs
  releases:
  - retrieved: '2021-02-02'
    version: 13-12-2019
  - retrieved: '2021-06-14'
    version: '2019-12-13'
  vtype: date
- name: Reactome
  prefix: reactome
  releases:
  - retrieved: '2020-12-11'
    version: '75'
  - retrieved: '2021-03-29'
    version: '76'
  - retrieved: '2021-06-25'
    version: '77'
  - retrieved: '2021-10-15'
    version: '78'
  - retrieved: '2022-01-25'
    version: '79'
  - retrieved: '2022-01-26'
    version: '78'
  - retrieved: '2022-02-04'
    version: '79'
  - retrieved: '2022-04-08'
    version: '80'
  vtype: sequential
- name: Regulation of Gene Expression Ontology
  prefix: rexo
  releases:
  - retrieved: '2021-02-02'
    version: 11-04-2019
  - retrieved: '2021-06-14'
    version: '2019-04-11'
  vtype: date
- name: Regulation of Transcription Ontology
  prefix: reto
  releases:
  - retrieved: '2021-02-02'
    version: 17-09-2019
  - retrieved: '2021-06-14'
    version: '2019-09-17'
  vtype: date
- name: Relation Ontology
  prefix: ro
  releases:
  - retrieved: '2021-02-02'
    version: '2020-12-18'
  - retrieved: '2021-03-10'
    version: '2021-03-08'
  - retrieved: '2021-07-06'
    version: '2021-06-23'
  - retrieved: '2021-09-08'
    version: '2021-08-04'
  - retrieved: '2021-09-09'
    version: '2021-06-23'
  - retrieved: '2021-09-15'
    version: '2021-08-31'
  - retrieved: '2021-10-31'
    version: '2021-10-27'
  - retrieved: '2021-12-11'
    version: '2021-12-06'
  - retrieved: '2022-01-26'
    version: '2022-01-20'
  - retrieved: '2022-03-03'
    version: '2022-02-07'
  - retrieved: '2022-05-10'
    version: '2022-04-25'
  vtype: date
- name: REPRODUCE-ME Ontology
  prefix: reproduceme
  releases:
  - retrieved: '2021-02-02'
    version: '1.1'
  vtype: semver
- name: Rfam
  prefix: rfam
  releases:
  - homepage: ftp://ftp.ebi.ac.uk/pub/databases/Rfam/14.4/
    retrieved: '2020-12-25'
    version: '14.4'
  - homepage: ftp://ftp.ebi.ac.uk/pub/databases/Rfam/14.5/
    retrieved: '2021-03-18'
    version: '14.5'
  - homepage: ftp://ftp.ebi.ac.uk/pub/databases/Rfam/14.6/
    retrieved: '2021-07-27'
    version: '14.6'
  - homepage: ftp://ftp.ebi.ac.uk/pub/databases/Rfam/14.7/
    retrieved: '2021-12-22'
    version: '14.7'
  vtype: semver_minor
- name: Rhea
  prefix: rhea
  releases:
  - date: '2020-12-02'
    retrieved: '2021-02-04'
    version: '116'
  - date: '2021-02-10'
    retrieved: '2021-02-12'
    version: '117'
  - date: '2021-04-07'
    retrieved: '2021-04-09'
    version: '118'
  - date: '2021-06-02'
    retrieved: '2021-06-25'
    version: '119'
  - date: '2021-09-29'
    retrieved: '2021-11-18'
    version: '120'
  - date: '2022-02-23'
    retrieved: '2022-03-03'
    version: '121'
  vtype: date
- name: Rice ontology
  prefix: co_320
  releases:
  - retrieved: '2021-02-02'
    version: 09-10-2019
  - retrieved: '2021-06-14'
    version: '2019-10-09'
  vtype: date
- name: RNA ontology
  prefix: rnao
  releases:
  - retrieved: '2021-04-14'
    version: 15-04-2019
  - retrieved: '2021-06-14'
    version: '2019-04-15'
  vtype: date
- name: RXNO
  prefix: rxno
  releases:
  - retrieved: '2021-02-02'
    version: '2021-01-21'
  vtype: date
- name: RxNorm
  prefix: rxnorm
  releases:
  - homepage: https://download.nlm.nih.gov/umls/kss/rxnorm/RxNorm_full_09072021.zip
    retrieved: '2021-09-25'
    version: '2021-09-07'
  - homepage: https://download.nlm.nih.gov/umls/kss/rxnorm/RxNorm_full_10042021.zip
    retrieved: '2021-10-05'
    version: '2021-10-04'
  - homepage: https://download.nlm.nih.gov/umls/kss/rxnorm/RxNorm_full_11012021.zip
    retrieved: '2021-11-02'
    version: '2021-11-01'
  - homepage: https://download.nlm.nih.gov/umls/kss/rxnorm/RxNorm_full_12062021.zip
    retrieved: '2021-12-07'
    version: '2021-12-06'
  - homepage: https://download.nlm.nih.gov/umls/kss/rxnorm/RxNorm_full_01032022.zip
    retrieved: '2022-01-04'
    version: '2022-01-03'
  - homepage: https://download.nlm.nih.gov/umls/kss/rxnorm/RxNorm_full_02072022.zip
    retrieved: '2022-02-08'
    version: '2022-02-07'
  - homepage: https://download.nlm.nih.gov/umls/kss/rxnorm/RxNorm_full_03072022.zip
    retrieved: '2022-03-08'
    version: '2022-03-07'
  - homepage: https://download.nlm.nih.gov/umls/kss/rxnorm/RxNorm_full_04042022.zip
    retrieved: '2022-04-05'
    version: '2022-04-04'
  - homepage: https://download.nlm.nih.gov/umls/kss/rxnorm/RxNorm_full_05022022.zip
    retrieved: '2022-05-03'
    version: '2022-05-02'
  vtype: date
- name: Saccharomyces Genome Database
  prefix: sgd
  releases:
  - date: '2021-04-21'
    retrieved: '2021-09-16'
    version: R64-3-1
  vtype: date
- name: Scientific Evidence and Provenance Information Ontology
  prefix: sepio
  releases:
  - retrieved: '2021-02-02'
    version: $Revision$
  vtype: garbage
- name: Semanticscience Integrated Ontology
  prefix: sio
  releases:
  - retrieved: '2021-02-02'
    version: '1.48'
  - retrieved: '2021-02-18'
    version: '1.49'
  - retrieved: '2021-02-25'
    version: '1.51'
  - retrieved: '2021-07-27'
    version: '1.53'
  vtype: semver
- name: Sequence Ontology
  prefix: so
  releases:
  - retrieved: '2021-02-02'
    version: '2021-01-27'
  - retrieved: '2021-02-04'
    version: '2021-02-01'
  - retrieved: '2021-02-12'
    version: '2021-02-11'
  - retrieved: '2021-02-18'
    version: '2021-02-16'
  vtype: date
- name: Sequence types and features ontology
  prefix: so
  releases:
  - retrieved: '2021-04-14'
    version: '2021-02-16'
  - retrieved: '2021-04-23'
    version: '2021-04-21'
  - retrieved: '2021-04-27'
    version: '2021-04-24'
  - retrieved: '2021-04-30'
    version: '2021-04-27'
  - retrieved: '2021-06-01'
    version: '2021-05-27'
  - retrieved: '2021-06-25'
    version: '2021-06-10'
  - retrieved: '2021-07-27'
    version: '2021-07-12'
  - retrieved: '2021-07-28'
    version: '2021-07-01'
  - retrieved: '2021-07-30'
    version: '2021-07-12'
  - retrieved: '2021-11-27'
    version: '2021-11-22'
  vtype: date
- name: Sickle Cell Disease Ontology
  prefix: scdo
  releases:
  - retrieved: '2021-02-02'
    version: '2019-06-26'
  - retrieved: '2021-05-08'
    version: '2021-04-15'
  vtype: date
- name: SNOMED CT (International Edition)
  prefix: snomedct
  releases:
  - retrieved: '2021-11-14'
    version: '2020-01-31'
  vtype: date
- name: Social Insect Behavior Ontology
  prefix: sibo
  releases:
  - retrieved: '2021-02-02'
    version: '2015-06-15'
  vtype: date
- name: Software ontology
  prefix: swo
  releases:
  - retrieved: '2021-04-14'
    version: '1.7'
  vtype: semver
- name: Sorghum ontology
  prefix: co_324
  releases:
  - retrieved: '2021-02-02'
    version: 09-10-2019
  - retrieved: '2021-06-14'
    version: '2019-10-09'
  vtype: date
- name: Spider Ontology
  prefix: spd
  releases:
  - retrieved: '2021-02-02'
    version: 27-02-2019
  - retrieved: '2021-06-14'
    version: '2019-02-27'
  vtype: date
- name: 'STATO: the statistical methods ontology'
  prefix: stato
  releases:
  - retrieved: '2021-02-02'
    version: RC1.4
  vtype: other
- name: StringDB
  releases:
  - date: '2020-10-17'
    retrieved: '2021-02-13'
    version: 11.0b
  - date: '2021-08-12'
    retrieved: '2021-08-13'
    version: '11.5'
  vtype: other
- name: Sugar Kelp trait ontology
  prefix: co_360
  releases:
  - retrieved: '2021-02-02'
    version: 26-06-2019
  - retrieved: '2021-06-14'
    version: '2019-06-26'
  vtype: date
- name: Sustainable Development Goals Interface Ontology
  prefix: sdgio
  releases:
  - retrieved: '2021-02-02'
    version: '2018-08-10'
  vtype: date
- name: Sweet Potato ontology
  prefix: co_331
  releases:
  - retrieved: '2021-02-02'
    version: 09-10-2019
  - retrieved: '2021-06-14'
    version: '2019-10-09'
  vtype: date
- name: SwissLipid
  prefix: swisslipid
  releases:
  - retrieved: '2021-11-15'
    version: '2021-11-15'
  - retrieved: '2021-11-17'
    version: '2021-11-16'
  - retrieved: '2021-11-18'
    version: '2021-11-17'
  - retrieved: '2021-11-19'
    version: '2021-11-18'
  - retrieved: '2021-11-20'
    version: '2021-11-19'
  - retrieved: '2021-11-21'
    version: '2021-11-20'
  - retrieved: '2021-11-22'
    version: '2021-11-21'
  - retrieved: '2021-11-23'
    version: '2021-11-22'
  - retrieved: '2021-11-24'
    version: '2021-11-23'
  - retrieved: '2021-11-25'
    version: '2021-11-24'
  - retrieved: '2021-11-26'
    version: '2021-11-25'
  - retrieved: '2021-11-27'
    version: '2021-11-26'
  - retrieved: '2021-11-28'
    version: '2021-11-27'
  - retrieved: '2021-11-30'
    version: '2021-11-29'
  - retrieved: '2021-12-01'
    version: '2021-11-30'
  - retrieved: '2021-12-02'
    version: '2021-12-01'
  - retrieved: '2021-12-03'
    version: '2021-12-02'
  - retrieved: '2021-12-04'
    version: '2021-12-03'
  - retrieved: '2021-12-05'
    version: '2021-12-04'
  - retrieved: '2021-12-06'
    version: '2021-12-05'
  - retrieved: '2021-12-07'
    version: '2021-12-06'
  - retrieved: '2021-12-08'
    version: '2021-12-07'
  - retrieved: '2021-12-09'
    version: '2021-12-08'
  - retrieved: '2021-12-09'
    version: '2021-12-09'
  - retrieved: '2021-12-11'
    version: '2021-12-10'
  - retrieved: '2021-12-12'
    version: '2021-12-11'
  - retrieved: '2021-12-13'
    version: '2021-12-12'
  - retrieved: '2021-12-14'
    version: '2021-12-13'
  - retrieved: '2021-12-15'
    version: '2021-12-14'
  - retrieved: '2021-12-16'
    version: '2021-12-15'
  - retrieved: '2021-12-17'
    version: '2021-12-16'
  - retrieved: '2021-12-18'
    version: '2021-12-17'
  - retrieved: '2021-12-19'
    version: '2021-12-18'
  - retrieved: '2021-12-20'
    version: '2021-12-20'
  - retrieved: '2021-12-22'
    version: '2021-12-21'
  - retrieved: '2021-12-23'
    version: '2021-12-22'
  - retrieved: '2021-12-24'
    version: '2021-12-23'
  - retrieved: '2021-12-25'
    version: '2021-12-24'
  - retrieved: '2021-12-26'
    version: '2021-12-26'
  - retrieved: '2021-12-28'
    version: '2021-12-27'
  - retrieved: '2021-12-29'
    version: '2021-12-28'
  - retrieved: '2021-12-30'
    version: '2021-12-29'
  - retrieved: '2021-12-31'
    version: '2021-12-30'
  - retrieved: '2022-01-01'
    version: '2021-12-31'
  - retrieved: '2022-01-02'
    version: '2022-01-02'
  - retrieved: '2022-01-04'
    version: '2022-01-03'
  - retrieved: '2022-01-05'
    version: '2022-01-04'
  - retrieved: '2022-01-06'
    version: '2022-01-06'
  - retrieved: '2022-01-07'
    version: '2022-01-07'
  - retrieved: '2022-01-09'
    version: '2022-01-09'
  - retrieved: '2022-01-11'
    version: '2022-01-10'
  - retrieved: '2022-01-12'
    version: '2022-01-11'
  - retrieved: '2022-01-13'
    version: '2022-01-13'
  - retrieved: '2022-01-14'
    version: '2022-01-14'
  - retrieved: '2022-01-16'
    version: '2022-01-16'
  - retrieved: '2022-01-18'
    version: '2022-01-18'
  - retrieved: '2022-01-20'
    version: '2022-01-20'
  - retrieved: '2022-01-23'
